Video_Title,Total_Views,Channel_Name,Video_Link,Channel_Link,Publish_Date,Description
Data Science For R Full Course 2022 | Data Science Tutorial | Simplilearn,17K views,Simplilearn,https://www.youtube.com/watch?v=zWX5KjhzM-A,https://www.youtube.com/c/SimplilearnOfficial,8 months ago,"Boost your career with Simplilearn's 6-months Data Science Job Guarantee Program with a placement, guarantee! Land your ..."
How Computer Vision Works,55K views,Code.org,https://www.youtube.com/watch?v=2hXG8v8p0KM,https://www.youtube.com/c/codeorg,1 year ago,"Computer Vision is a form of machine learning used in self-driving cars, facial recognition systems, and sustainable farming."
Oracle SQL |14| self join| Marathi| #oracledatabasetutorial #datascience,1 view,EngineeringScience,https://www.youtube.com/watch?v=qxLBpSo1YyM,https://www.youtube.com/channel/UC-HbobgOx_02jnJjWitXdpQ,1 hour ago,
Natural Language Processing| Stemming And Lemmatization Intuition,89K views,Krish Naik,https://www.youtube.com/watch?v=JpxCt3kvbLk,https://www.youtube.com/user/krishnaik06,2 years ago,In this video we will understand the detailed explanation of Lemmatization and understand how it can be used in Natural ...
Tutorial: Traditional Machine Learning with oneDAL and XGBoost*,90 views,Intel eXtreme Performance Users Group - IXPUG,https://www.youtube.com/watch?v=YYrm03DMBAA,https://www.youtube.com/channel/UCqSvlSWwA3-A8FcrhE6FjiQ,1 year ago,"IXPUG Annual Conference 2020 – tutorial: Traditional Machine Learning with oneDAL and XGBoost* (Rachel Oberman, Intel ..."
SQL for Data Science (Intuitive Introduction),1.1K views,Andrew Jones,https://www.youtube.com/watch?v=O10Du9zWZxY,https://www.youtube.com/channel/UCp8-ZIYr3XgQnwJEslHpt2A,1 year ago,"I asked over 100 Data Science Leaders...""Does your Data Science Team utilise SQL?"" 97% said yes... 97!! If you want to work in ..."
Advantages of R for data science | DAC.digital,7 views,DAC.digital - Software Development Company,https://www.youtube.com/watch?v=GJ-Mm9-7A2A,https://www.youtube.com/channel/UC72df3H_-v-Zuif7wOYdOJQ,6 months ago,Millions of data scientists and statisticians use R to solve statistical computing and quantitative marketing problems. Companies ...
3 Types of Data Science Interview Questions,582K views,Joma Tech,https://www.youtube.com/watch?v=4Z6lxfglvUU,https://www.youtube.com/c/JomaOppa,4 years ago,Join my Crypto Discord Server and be part of my NFT project: https://discord.gg/vaxxeddoggos https://twitter.com/VaxxedDoggos ...
Data Analytics 3 months roadmap #dataanalytics #datascience #upgradeskill #livetraining,13K views,Aditi Gupta,https://www.youtube.com/shorts/PeIJngh9VjE,https://www.youtube.com/channel/UCdq65x-0_G8sMhwWNgtmXaQ,1 month ago,Here is the three month study plan for all the data analytics thresholds one to two weeks learn about basic excel two to six weeks ...
DATA SCIENTIST CAREER STORY (how I became a data scientist & revealing my salaries),19K views,Damsel in Data,https://www.youtube.com/watch?v=A2v4_SFd9Cc,https://www.youtube.com/channel/UCenqe6Cvfd47aHAOb9Qe8yA,7 months ago,Ever wanted to hear about the career journey of a data scientist who thinks she's qualified enough to make over-produced videos ...
Learn TensorFlow and Deep Learning fundamentals with Python (code-first introduction) Part 1/2,462K views,Daniel Bourke,https://www.youtube.com/watch?v=tpCFfeUEGs8,https://www.youtube.com/channel/UCr8O8l5cCX85Oem1d18EezQ,1 year ago,"Ready to learn the fundamentals of TensorFlow and deep learning with Python? Well, you've come to the right place. After this ..."
Preparing for SQL Interviews? Watch This | SQL Interview | Data Science Interview,13K views,Data Interview Pro,https://www.youtube.com/watch?v=1tfGvvVOF6Q,https://www.youtube.com/c/DataInterviewPro,5 months ago,SQL is a necessity for data scientist. This video looks at 3 categories of SQL questions. Knowing the categories of questions will ...
الفرق بين Data science vs Artificial Intelligence vs Machine Learning vs Deep Learning,48K views,أجياد العرب,https://www.youtube.com/watch?v=IMrwjn9rwQc,https://www.youtube.com/c/%D8%A3%D8%AC%D9%8A%D8%A7%D8%AF%D8%A7%D9%84%D8%B9%D8%B1%D8%A8,1 year ago,شرح مختصر وسهل و مبسط الفرق بين Data science vs Artificial Intelligence vs Machine Learning vs Deep Learning شرح تفصيلي و ...
5 Impactful Data Science Projects For Your Portfolio,25K views,Ken Jee,https://www.youtube.com/watch?v=QMP858aZcow,https://www.youtube.com/c/KenJee1,2 months ago,datascience #KenJee #machinelearning I walk through 5 high-impact data science projects that you can add to your data science ...
Google SQL Interview Question for Data Scientists and Product Analysts (StrataScratch 9668),5.5K views,Frederik Müller,https://www.youtube.com/watch?v=-f_Ix9VVHxo,https://www.youtube.com/channel/UCuDWqzSSHgHkD0zBwrIXSNQ,10 months ago,Solution and walkthrough of a real SQL interview question for Data Scientist and Data Analyst technical coding interviews.
How to get a data science job,55K views,Tina Huang,https://www.youtube.com/watch?v=71RVNeseKZw,https://www.youtube.com/c/TinaHuang1,1 year ago,This video is for those of you who are learning data science in the hopes of getting a data science internship or job. Just because ...
All Data Science Degree Courses For FREE! Harvard MIT Free Courses,126K views,Ishan Sharma,https://www.youtube.com/watch?v=3USVW3kpwyY,https://www.youtube.com/c/IshanSharma7390,10 months ago,"In this video, I talk about a free learning path that you can take to learn about data science. This path includes all the courses you ..."
"Data Science In Australia Q And A (PR, Lifestyle, Salary!)",5.3K views,Samanvay Karambhe,https://www.youtube.com/watch?v=eQ_QkOnVVO0,https://www.youtube.com/c/SamanvayKarambhe,6 months ago,"Data Science is a growing industry in Australia. Over the past few months, I have gotten tons of common questions about the state ..."
Data Scientist Salary in UK in 2021 ❌ Everything You Need to Know,31K views,DecisionForest,https://www.youtube.com/watch?v=773P0cPIbTU,https://www.youtube.com/c/DecisionForest,1 year ago,"I can talk about data scientist salaries in the UK as this is where I'm located. I've had my fair share of jobs, both perm and contracts ..."
Object Tracking | Student Competition: Computer Vision Training,15K views,MATLAB,https://www.youtube.com/watch?v=0jAC9sMQQuM,https://www.youtube.com/c/matlab,2 years ago,"© 2019 The MathWorks, Inc. MATLAB and Simulink are registered trademarks of The MathWorks, Inc. See ..."
How Computer Vision Works,252K views,Google Cloud Tech,https://www.youtube.com/watch?v=OcycT1Jwsns,https://www.youtube.com/user/googlecloudplatform,4 years ago,The Google Cloud Vision and Video Intelligence APIs give you access to a pre-trained machine learning model with a single ...
R for Data Science: Download & Installation | 101 ( 4:50 min.),174 views,Outliers Analytics,https://www.youtube.com/watch?v=V8adV8rgAek,https://www.youtube.com/c/OutliersAnalytics,3 years ago,"Are you confused or new to data science? Don't worry! you can check out this video class, to learn how to download & install R ..."
"1. Natural Language Processing, Dan Jurafsky (Stanford University)",4.2K views, LOGANFORD Academy,https://www.youtube.com/watch?v=ie-YEyfoQ28,https://www.youtube.com/c/LOGANFORDAcademy101,3 months ago,Specialization Link: https://www.youtube.com/playlist?list=PLyzos0B_O8rSj4yPjWf2tfl7l05F8GcwG ...
4 steps of natural language processing,1.9K views,OU Education,https://www.youtube.com/watch?v=q2-gI4opqhI,https://www.youtube.com/c/OUEducation,2 years ago,Still Confused DM me on WhatsApp (*Only WhatsApp messages* calls will not be lifted)
Live Mock Interview For Data Analyst| Data Science  By Ranjan Sir | Datagyan,201K views,Data Gyan,https://www.youtube.com/watch?v=mEWNgapblkk,https://www.youtube.com/c/DataGyan,1 year ago,"Data Gyan, Bangalore is the most preferred institute for freshers & working professionals. IIT Kharagpur recognize that Data ..."
Credit Card Customers Case Study | MySQL | Data Analysis | Md Hassan Iqbal | IvyProSchool,12K views,IvyProSchool,https://www.youtube.com/watch?v=9tR4ShTYYlE,https://www.youtube.com/c/IvyProSchool,1 year ago,"Subscribe to Our YouTube Channel to get regular updates on amazing Data Science Industry Talks, Interviews, and Webinars."
Live Q&A-Ask Anything Related To Data Science,8.3K views,Krish Naik,https://www.youtube.com/watch?v=Hgjax-GPsAw,https://www.youtube.com/user/krishnaik06,Streamed 1 day ago,Just 2 days left for the Data Science Industry Ready Projects Course. In this course we will be learning how to implement end to ...
How To Find Trending Topics For YouTube Videos (2022) | Python | Project For Beginners,89 views,AI Sciences,https://www.youtube.com/watch?v=YpSQly9RDCs,https://www.youtube.com/c/AISciencesLearn,21 hours ago,Get a look at our course on data science and AI here: https://bit.ly/3thtoUJ The Python Codes are available at this link: ...
How To Learn Python For Machine Learning (NumPy & Pandas Guide),5.6K views,Smitha Kolan - Machine Learning Engineer,https://www.youtube.com/watch?v=VsRFqvijF6M,https://www.youtube.com/c/SmithaKolan,1 year ago,"Python is an extremely popular programming language and it has a wide range of applications, most notably, it's one of the most ..."
"MUST Do SQL Topics For FAANG 2022🔥 BEGINNER + ADVANCE Level | Data Engineer, Data Scientist, Analyst",30K views,E-Learning Bridge,https://www.youtube.com/watch?v=Y7R4X6ZOSS0,https://www.youtube.com/c/LearningBridge,8 months ago,"Tags: sql,sql query,faang,data engineer,shashank mishra amazon,sql interview query,sql interview questions,sql interview,sql ..."
How I Would Learn Data Science in 2022 (If I Could Start Over) part 2,20K views,Sundas Khalid,https://www.youtube.com/watch?v=8UUhGXmT0O8,https://www.youtube.com/c/SundasKhalid,2 months ago,"Hi friends, in today's video I am sharing the framework + top data science Coursera courses on how I would learn data science in ..."
500+ Interview Questions On Data Analyst And Business Analytics,36K views,Krish Naik,https://www.youtube.com/watch?v=1oW2_QAuAyI,https://www.youtube.com/user/krishnaik06,1 year ago,Interview pdf link: https://drive.google.com/file/d/1O9iv6_HzAh_aNcbVQcbnIQuNrL9tpfFh/view?usp=sharing ⭐ Kite is a free ...
Why You Probably Won't Become a Data Scientist,124K views,Ken Jee,https://www.youtube.com/watch?v=sHRq-LshG3U,https://www.youtube.com/c/KenJee1,1 year ago,In this video I highlight the main reasons why it is unlikely that you will become a data scientist. TO BE CLEAR I still think it is ...
Using Computer Vision to Help Visually Impaired People,1.6K views,Omdena,https://www.youtube.com/watch?v=I_bVzTjETbk,https://www.youtube.com/c/Omdena,8 months ago,"In this 8-weeks challenge, 35 collaborators worked on solving a significant daily-life mobility & orientation challenge for people ..."
Which Programming Language for AI? | Machine Learning,250K views,Telusko,https://www.youtube.com/watch?v=hQyUwF2vaac,https://www.youtube.com/c/Telusko,4 years ago,Developers who are moving towards Artificial intelligence and Machine learning are confused as which language is the best ...
🧐 Data Scientist Vs Data Analyst Vs Data Engineer - 📌Curso DATA SCIENCE 2021 #6,26K views,DataScience ForBusiness,https://www.youtube.com/watch?v=0RQcclyLh7Q,https://www.youtube.com/c/DataScienceForBusiness,1 year ago,Curso gratis de Data Science con Python: www.tuprimerasemana.com Este vídeo es parte de una LISTA que responderá a tus ...
Google Data Analytics Professional Certificate | It's Finally Here!,300K views,Alex The Analyst,https://www.youtube.com/watch?v=wnapnTAMj68,https://www.youtube.com/c/AlexTheAnalyst,1 year ago,The Google Data Analytics Professional Certificate is live!! LINK: https://coursera.pxf.io/5bBd62 This Certificate has been a long ...
How I Would Learn to be a Data Analyst,777K views,Luke Barousse,https://www.youtube.com/watch?v=CC66RXeTn_4,https://www.youtube.com/c/LukeBarousse,8 months ago,... Data Science https://lukeb.co/SQLdataScience Excel Skills for Business https://lukeb.co/ExcelBusinessAnalyst Data ...
Data Science vs Machine Learning – What’s The Difference? | Data Science Course | Edureka,112K views,edureka!,https://www.youtube.com/watch?v=0cSFjaXMHpM,https://www.youtube.com/c/edurekaIN,3 years ago,(00:47)What Is Data Science? (02:32)What Is Machine Learning? (04:06)Fields Of Data Science (05:32)Use Case Python ...
Advanced Computer Vision with Python - Full Course,1M views,freeCodeCamp.org,https://www.youtube.com/watch?v=01sAkU_NvOY,https://www.youtube.com/c/Freecodecamp,1 year ago,Learn advanced computer vision using Python in this full course. You will learn state of the art computer vision techniques by ...
NumPy Full Python Course - Data Science Fundamentals,9.1K views,NeuralNine,https://www.youtube.com/watch?v=4c_mwnYdbhQ,https://www.youtube.com/c/NeuralNine,7 months ago,This video is a full crash course for NumPy in Python. We learn everything from scratch.
Day in the Life of a Data Analyst - SurveyMonkey Data Transformation,2M views,Shashank Kalanithi,https://www.youtube.com/watch?v=pKvWD0f18Pc,https://www.youtube.com/c/ShashankKalanithiData,1 year ago,This is a tutorial of a project I did for a client where I transformed data using Excel and Python. I explain and walk you through the ...
Data Scientist vs. Data Analyst vs. Data Engineer - What's the Difference?,521 views,DataLyfe,https://www.youtube.com/watch?v=X39l5GLjHU0,https://www.youtube.com/channel/UCuagyOmcBIkvbdc4nr2SHwA,1 year ago,Interested in getting into Data? Here's a breakdown of the most popular jobs in Data and key differences between each one.
"Women in Data Science Fireside Chat with Cathy Tanimura, Eren Manavoglu and Yan Guo",263 views,Microsoft Research,https://www.youtube.com/watch?v=btM_leHlMfU,https://www.youtube.com/user/MicrosoftResearch,23 hours ago,Women in Data Science at Microsoft (WiDS) Community started as a workshop at the Microsoft Machine Learning and Data ...
The 5 Biggest Computer Vision Trends In 2022,2.9K views,Bernard Marr,https://www.youtube.com/watch?v=qZWFnl8jmi4,https://www.youtube.com/c/BernardMarrAPI,6 months ago,Computer vision (sometimes called machine vision) is one of the most exciting applications of artificial intelligence. Algorithms that ...
Data science applications with TabPy/R,34K views,Tableau Software,https://www.youtube.com/watch?v=nRtOMTnBz_Y,https://www.youtube.com/c/tableausoftware,3 years ago,"In this session, we will learn how to deploy connections between Tableau and its advanced analytics external services. We will ..."
R For Data Science Full Course | Data Science With R Full Course |Data Science with R -Part-11,37 views,KSR Datavizon ,https://www.youtube.com/watch?v=-2sKTDqUItw,https://www.youtube.com/c/KSRDatavizon,1 year ago,"In this video on R for Data Science Full Course, we'll start by learning data science from introduction video. You will then learn the ..."
Introduction - Deep Learning and Neural Networks with Python and Pytorch p.1,394K views,sentdex,https://www.youtube.com/watch?v=BzcBsTou0C0,https://www.youtube.com/c/sentdex,3 years ago,"Hello and welcome to a deep learning with Python and Pytorch tutorial series, starting from the basics. Text-based tutorials and ..."
Data Analytics vs. Data Science,396 views,Sundog Education with Frank Kane,https://www.youtube.com/watch?v=poYOLhe7trc,https://www.youtube.com/c/SundogEducation,7 months ago,What are the differences between data science vs. data analytics? The truth is there are no hard and fast rules. Different ...
"I did Analysis of Airbnb Bookings Data using Python, Excel and Tableau",5.4K views,Python Soldiers,https://www.youtube.com/watch?v=Q2AFVafpRJA,https://www.youtube.com/c/PythonSoldiers,10 months ago,"About Airbnb Booking Data: Since 2008, guests and hosts have used Airbnb to expand on traveling possibilities and present a ..."
Machine Learning Morning Session,No views,Napat Jitpaisarnwattana,https://www.youtube.com/watch?v=361eHuVqklU,https://www.youtube.com/user/siarung47,7 minutes ago,
Data Science at TU Dortmund University,7.9K views,TU Dortmund – International Office,https://www.youtube.com/watch?v=QNkmStNYkyc,https://www.youtube.com/c/TUDortmund-InternationalOffice,10 months ago,"Are you interested in statistics, mathematics and computer science? Modern statistical methods are used in every field of work in ..."
what is Machine Learning in telugu,77K views,telugu tech explains,https://www.youtube.com/watch?v=H6Zpk5lL_1s,https://www.youtube.com/c/telugutechwithharish,4 years ago,"it is defined as ability to learn from the past experience...it iss used in google,youtube,voice assisatnce..it can be implemented by 3 ..."
4 CR+ SALARY for DATA SCIENTISTS ??🔥GATE AIR-2 to MACHINE LEARNING @ AMAZON🔥 Scaler Data Science,339K views,E-Learning Bridge,https://www.youtube.com/watch?v=6Gd9i3DxhkM,https://www.youtube.com/c/LearningBridge,1 month ago,"With 13 years of expertise, the lead instructor, Srikanth Varma Chekuri, co-founder and principal instructor at Applied AI ..."
BCA Data Science Complete Information | Data Science Scope in  India | BCA Course Details in Hindi |,5.5K views,Students Can I Help You?,https://www.youtube.com/watch?v=SDeSmDoRAXg,https://www.youtube.com/c/StudentsCanIHelpYou,3 months ago,BCA Data Science Complete Information | Data Science Scope in India | BCA Course Details in Hindi | ☑ BCA VIDEO EBOOK: ...
R for Data Science: Vectors (r4ds06 20),33 views,R4DS Online Learning Community,https://www.youtube.com/watch?v=bRwmyUbario,https://www.youtube.com/c/R4DSOnlineLearningCommunity,2 months ago,"Adeyemi Olusola presents Chapter 20 (""Vectors"") from R for Data Science by Hadley Wickham & Garrett Grolemund on ..."
Successful Transition Story From Mechanical Engineer To A Data Scientist,46K views,Krish Naik,https://www.youtube.com/watch?v=niaI15AuYTA,https://www.youtube.com/user/krishnaik06,2 years ago,Machine Learning involves a lot of programming and can only be learnt by practicing over and over again. Hitesh Linked In ...
HOW TO BECOME DATA SCIENTIST IN TAMIL 2022 | HOW TO BECOME DATA SCIENTIST IN INDIA | SKILLS | SALARY,18K views,Coding Tamilan,https://www.youtube.com/watch?v=X9HSp0mlcWk,https://www.youtube.com/c/CodingTamilan,1 year ago,DATASCIENTIST #COSINGTAMILAN #HOWTOBECOME Official Telegram Page https://t.me/codingtamilan Contact us ...
How a Data Analysts Solves an SQL Problem (comment a better solution below),9.4K views,Shashank Kalanithi,https://www.youtube.com/watch?v=HlBRB7DZ1pY,https://www.youtube.com/c/ShashankKalanithiData,8 months ago,"Today we're working on forward filling rows in SQL using window functions, continuous table expressions, and pivots! My FREE ..."
Create Dummy (Categorical) Variables with Pandas in Python (No sklearn),2.1K views,Data Science Garage,https://www.youtube.com/watch?v=YLK-5u4zjMk,https://www.youtube.com/c/VytautasBielinskas,3 years ago,"With this video tutorial I tried to demonstrate how to create dummy categorical features, in another words columns or variables, ..."
7 Frequently Asked Questions on AI in Computer Vision,8.5K views,Augmented Startups,https://www.youtube.com/watch?v=e18hD3God58,https://www.youtube.com/c/AugmentedStartups,3 years ago,Hey guys and welcome back so I want to take you quickly through the 7 most commonly asked questions that I have been asked ...
Why we love using R programming for data analysis,2.4K views,R Programming 101,https://www.youtube.com/watch?v=X9wdU7_Kr-I,https://www.youtube.com/c/RProgramming101,Streamed 4 weeks ago,If you need to analyze data or do statistical analysis then we seriously recommend that you consider using R programming.
How I Became Data Scientist/ML Engineer at age of 14,131K views,Ayush Singh,https://www.youtube.com/watch?v=AqkVxq-I39E,https://www.youtube.com/c/AyushSinghSh,2 months ago,"Hey Guys! Today in this video, I am going to tell how I became a machine learning engineer and data scientist at 14. How I was ..."
"How to Import Numpy, Pandas, Matplotlib and Seaborn Using Python(python)(data analysis)(NumPy)",491 views,Research Methodology Advanced Tools,https://www.youtube.com/watch?v=f3X8dQ5DCmE,https://www.youtube.com/c/ResearchMethodologyAdvancedTools05,8 months ago,"https://www.youtube.com/channel/UCiTOUGVoZDvMTyxAZnd9tsw How to Import Numpy, Pandas, Matplotlib and Seaborn Using ..."
Install Python for Data Science on Mac & Windows (PC) with Anaconda - P.1,13K views,Luke Barousse,https://www.youtube.com/watch?v=xfAcErzOKN4,https://www.youtube.com/c/LukeBarousse,1 year ago,"This video covers how data scientists and data analysts install Python using the Anaconda distribution. Additionally, we will cover ..."
Data Science vs Software development - Which career path is the most Rewarding?,337K views,CodeWithHarry,https://www.youtube.com/watch?v=KDCIycGqacU,https://www.youtube.com/c/CodeWithHarry,11 months ago,In terms of making money and salary expectations which out of Data Science/Machine Learning and Software development is the ...
"Learn data analyst skills in 3 months, step by step | Complete data analyst roadmap in 2022",1.1M views,codebasics,https://www.youtube.com/watch?v=_eAl7vuVu3U,https://www.youtube.com/c/codebasics,1 year ago,Do you want to learn data analyst skills and not sure where to start? In this video I will provide a 3 months step by step roadmap to ...
Introduction to Business Data Analytics | Techcanvass,3.8K views,Techcanvass,https://www.youtube.com/watch?v=Oqc4LZ6TuoY,https://www.youtube.com/c/TechcanvassAcademy,9 months ago,"Get to know the what, why and how of business data analytics: the most in-demand field. Techcanvass is a Premier PMI ..."
UiPath Fast Track Release: Computer Vision for human-like recognition of on-screen elements,6.2K views,UiPath,https://www.youtube.com/watch?v=6_5A1dSRsRU,https://www.youtube.com/c/UiPath,3 years ago,Computer Vision is now available with UiPath Fast Track Release. Computer Vision is generally available for on-premise users ...
5 Super Cool Computer Vision Applications Using Deep Learning,9.4K views,Smitha Kolan - Machine Learning Engineer,https://www.youtube.com/watch?v=AYfVTRtPg30,https://www.youtube.com/c/SmithaKolan,2 years ago,In today's video I'm going to be talking about 5 really cool computer vision applications that can be implemented using deep ...
Is Data Science Dying in 2022?,114K views,Recall by Dataiku,https://www.youtube.com/watch?v=rqvyWUODZGE,https://www.youtube.com/c/RecallbyDataiku,2 months ago,"In this video, I talk about if data science is a dying field in 2022. I think this is a very legitimate concern since we've seen whole ..."
95% Off R Programming: Advanced Analytics In R For Data Science Coupon,31 views,Erik V. Miller,https://www.youtube.com/watch?v=a2pOdT_n-vk,https://www.youtube.com/channel/UCkJMNWIrqGxgSuZTZ3A2Ixw,4 years ago,How to take the R Programming: Advanced Analytics In R For Data Science course for only $9.99? Look at the very easy steps to ...
How I'm Teaching Myself AI & Machine Learning online,13K views,Internet Made Coder,https://www.youtube.com/watch?v=2uAtNaC3RTo,https://www.youtube.com/c/InternetMadeCoder,1 month ago,How to self study Artificial Intelligence and Machine Learning Online in 2022 for free. RESOURCES MENTIONED: Machine ...
Kupas Tuntas Nasib Karir di Bidang Data Science: Apakah Benar Peluang Kerjanya Semakin Kecil?!,7.5K views,Purwadhika Digital Technology School,https://www.youtube.com/watch?v=2hX-e2-8ixI,https://www.youtube.com/c/PurwadhikaTV,2 months ago,Banyak yang beranggapan bahwa karir di bidang Data Science semakin menurun dan sudah jarang terdengar. Di video kali ini ...
The Best Examples Of Machine Vision,2.9K views,Bernard Marr,https://www.youtube.com/watch?v=ZRDtI1KgXsU,https://www.youtube.com/c/BernardMarrAPI,1 year ago,"Here are the best examples of machine vision, including biometric airport gates, quality and inventory control, farming, safety, cars ..."
🔥Data Science Full Course 2022 | Data Science | Data Science For Beginners | Simplilearn,285K views,Simplilearn,https://www.youtube.com/watch?v=xvEKQefqQ7A,https://www.youtube.com/c/SimplilearnOfficial,Streamed 8 months ago,"Boost your career with Simplilearn's 6-months Data Science Job Guarantee Program with a placement, guarantee! Land your ..."
E1 | From An ECE Fresher To Data Scientist @ Gojek | CAREER KI BAAT WITH AKASH RAJ,1.3K views,CloudyML,https://www.youtube.com/watch?v=ECmVjp-MCsc,https://www.youtube.com/c/cloudyML,1 day ago,If you also wanna be a part of our podcast series then please follow the link below and fill the google form and we will contact you ...
"Data Science Course Kya hai ? | 12th Ke Baad Course Kaise Kare ? | B. Tech | Eligibility, Jobs?",11K views,Educational Words Touch,https://www.youtube.com/watch?v=9ES-C_8TxaM,https://www.youtube.com/c/EducationalWordsTouch,7 months ago,"Hi, Welcome to my You Tube channel Educational Words Touch. About this video:- In this video I will discuss about 12th ke baad ..."
SQL Case Statements For Data Science Interviews in 2021,41K views,StrataScratch,https://www.youtube.com/watch?v=W_IERUwElkg,https://www.youtube.com/channel/UCW8Ews7tdKKkBT6GdtQaXvQ,1 year ago,Let's cover 3 types of SQL case statements that show up on data science interviews and that you'd use daily as a data scientist.
Data Science Full Course - Learn Data Science in 10 Hours | Data Science For Beginners | Edureka,2.6M views,edureka!,https://www.youtube.com/watch?v=-ETQ97mXXF0,https://www.youtube.com/c/edurekaIN,3 years ago,----------Edureka Data Science Training & Certifications------------ Data Science Training using Python: http://bit.ly/2P2Qbl8 ...
