Video_Title,Total_Views,Channel_Name,Video_Link,Channel_Link,Publish_Date,Description
Data Analyst vs Data Scientist | What are the differences?,608 views,McKay Johns,https://www.youtube.com/watch?v=EIOt88gZWtg,https://www.youtube.com/c/McKayJohns,1 year ago,"In this video, we'll cover four key differences between a data analyst and a data scientist. 1. Responsibilities 2. Education 3."
How to Clean Raw Data in SQL | Google Data Analytics Certificate,47K views,Google Career Certificates,https://www.youtube.com/watch?v=r7GDQt3lZxs,https://www.youtube.com/c/GoogleCareerCertificates,1 year ago,"Learn about the different data cleaning functions in spreadsheets and SQL, and how SQL can be used to clean large datasets."
How I use Machine Learning as a Data Analyst,61K views,Luke Barousse,https://www.youtube.com/watch?v=AopGnnPPczY,https://www.youtube.com/c/LukeBarousse,3 weeks ago,"As a member of the Amazon, Coursera, Hostinger, Parallels, Interview Query, and Data Camp Affiliate Programs, I earn a ..."
Different Data Science Roles Explained (by a Data Scientist),49K views,Ken Jee,https://www.youtube.com/watch?v=BZFfNwj7JhE,https://www.youtube.com/c/KenJee1,2 years ago,DataScience #KenJee #DataScienceRoles In this video I explain the different data science roles that exist under the broader data ...
Data Scientist Job Description explained by Brillio Data Scientist,80K views,Springboard India,https://www.youtube.com/watch?v=4mVcZWm3pd0,https://www.youtube.com/c/SpringboardInd,2 years ago,"In this video Indira Krishnamoorthi, Senior Data Scientist at Brillio and Mentor at Springboard talks about different Data Scientist ..."
Decision Tree Algorithm | Decision Tree in Python | Machine Learning Algorithms | Edureka,437K views,edureka!,https://www.youtube.com/watch?v=qDcl-FRnwSU,https://www.youtube.com/c/edurekaIN,4 years ago,1. What is Classification? 2. Types of Classification 3. Classification Use Case 4. What is Decision Tree? 5. Decision Tree ...
3 Essential Excel skills for the data analyst,547K views,Access Analytic,https://www.youtube.com/watch?v=I1XeDS-GLbg,https://www.youtube.com/c/AccessanalyticAus,1 year ago,"This is my opinion on the 3 key Excel skills a data analyst requires. Understanding the use of Power Query, Tables and Pivot ..."
Google Data Analytics Professional Certificate - Full course Part 1 of 7,395K views,Free Engineering Courses,https://www.youtube.com/watch?v=qZ6TJc5bSKU,https://www.youtube.com/channel/UCOz4UFPXUiSlMvsekJP02jg,1 year ago,"------------------------ This is the course ""Foundations: Data, Data, Everywhere"", part 1 of 8 of the full professional certificate that you ..."
🔥Don't prepare Data science|| why??🔥|| lot of problems||Siddhartha live,3.1K views,Siddhartha live,https://www.youtube.com/watch?v=tlbamRdtI4U,https://www.youtube.com/c/Siddharthalive,1 month ago,"Data Science software developer SQL Hadoop java, my SQL, placement course, free certificate yt:cc=on, data science, Data ..."
A Day in The Life of a Data Scientist 👨🏻‍💻| upGrad,2.2M views,upGrad,https://www.youtube.com/watch?v=de7ZUb1fH3s,https://www.youtube.com/c/UpGradGlobal,2 years ago,"#DataScience #DataScientist #Tech #Bigdata #Data #upGradTech #upGradcourses If you like this video, please subscribe to ..."
DSC ML Talks : Session 1,594 views,GDSC VIT BHOPAL,https://www.youtube.com/watch?v=H_X3dBLK7S4,https://www.youtube.com/channel/UCVr5tPwyUH8rJd5yEhBd94w,Streamed 1 year ago,"DSC ML Talks is a month-long event focused on ML beginners and freshers, aimed at getting them acquainted with the basics of ..."
"Simulating COVID-19 using Python, NumPy & Matplotlib [in-depth tutorial]",49K views,Kite,https://www.youtube.com/watch?v=KAmZe5D3v5I,https://www.youtube.com/c/KiteHQ,2 years ago,"In this in-depth Python tutorial using NumPy and Matplotlib, Caelan walks you through how to simulate the spread of a virus, using ..."
Business Intelligence vs Data Science,2.7K views,Maven Analytics,https://www.youtube.com/watch?v=mBB1jWeqEWg,https://www.youtube.com/c/MavenAnalytics,2 months ago,Have you ever tried to figure out the difference between Data Science & Business Intelligence? Or wondered which one you ...
Tutorial: Computer Vision,6.2K views,MITCBMM,https://www.youtube.com/watch?v=QTvOW-sJjjM,https://www.youtube.com/c/MITCBMM,4 years ago,"Andrei Barbu, MIT BMM Summer Course 2018."
"Applications of computer vision | Deep Learning Tutorial 22 (Tensorflow2.0, Keras & Python)",49K views,codebasics,https://www.youtube.com/watch?v=aDpnaxPAmtU,https://www.youtube.com/c/codebasics,1 year ago,Advancements in deep learning (especially invention of convolutional neural network or CNN or ConvNet) has made possible ...
"bert ,lstm nlp, named entity recognition transformers theory and coding data science preparation",1 view,Data scientist Software Engineer,https://www.youtube.com/watch?v=3vH2f630Ljs,https://www.youtube.com/channel/UC-BvJdQssVpWrbxp6rYPcug,38 minutes ago,data science nlp bert #bert #lstm #nlp #datascience #machinelearning #python #artificialintelligence #ai #data #dataanalytics ...
Data Analyst कैसे बने? Data Scientist Vs Data Engineer | Which is Best? | Where to Learn,14K views,Skillsiya,https://www.youtube.com/watch?v=m3dNd4UaVC0,https://www.youtube.com/c/Skillsiya,2 weeks ago,Looking for a job in data analytics? Struggling to decide which specialization is best? This video should help. Let's find out what ...
Data Analyst | Data Analyst Course | Data Analytics | Data Analytics Full Course 2022 | Simplilearn,956K views,Simplilearn,https://www.youtube.com/watch?v=A1JN_UN3mYE,https://www.youtube.com/c/SimplilearnOfficial,Streamed 1 year ago,"In this Data Analyst Full Course video, you will learn what data analytics is, why data analytics is necessary, the types of data ..."
CX Talks Focus Session: Tuukka Josefsson on Leveraging AI & ML in CX,60 views,TDCX,https://www.youtube.com/watch?v=L8xpJsx7k4s,https://www.youtube.com/c/TDCXgroup,6 hours ago,How are artificial intelligence and machine learning contributing to safe online spaces and content moderation? Tuukka ...
"A day in the life of a Data Scientist (lifestyle) | Stockholm, Sweden",314K views,Anastasia K,https://www.youtube.com/watch?v=Hz4ihJJAMJ8,https://www.youtube.com/c/AnastasiaKVL,1 year ago,"Decided to try out the 'A day in the life of a ...' format, so here is something different. My not super typical, but still a somewhat ..."
Build Your First Machine Learning AI With Neural Networks,67K views,Web Dev Simplified,https://www.youtube.com/watch?v=60c4rMq-aH0,https://www.youtube.com/c/WebDevSimplified,2 years ago,Machine learning is awesome. Who doesn't want to build a cool AI that you can teach to do anything. The only problem is ...
Building Computer Vision Datasets in Coco Format,2.8K views,Anuj Syal,https://www.youtube.com/watch?v=E-_o2Q0YTrs,https://www.youtube.com/c/AnujSyal,1 year ago,Chapters: 0:00 Intro 1:01 What is computer vision? 1:23 Coco Datasets 2:13 Understanding CV use case: Airbnb Amenity ...
ArcGIS API for Python for Analysts and Data Scientists,502 views,Esri Events,https://www.youtube.com/watch?v=AwlkZe7w44A,https://www.youtube.com/c/EsriEvents,3 years ago,Python has positioned itself as a highly suitable programming/scripting language for data exploration and analysis with its rich ...
Guide to choose machine vision camera! | Qualitas Technologies,6.9K views,Qualitas Technologies (A Machine Vision Company),https://www.youtube.com/watch?v=V_rR3vtC-J8,https://www.youtube.com/c/QualitasTechnologies,2 years ago,Choosing the right camera for your machine-vision system is often considered as the X factor for your success/failure. Here are a ...
Data Science Course | Data Analytics | Data Science Course As Per Career,82 views,CEDLEARN,https://www.youtube.com/watch?v=TXT8dRgcGlM,https://www.youtube.com/channel/UC-uMDy6w788jIQUyoL1p2mw,3 months ago,This Data Science course emphasizes on Project-Based Learning to meet the learning needs of students from various ...
TCS SQL/ PLSQL  Real Interview BY TCS Team ! TCS Interview Recording Simulation ! TCS Ninja Hiring,1M views,CodyMinati,https://www.youtube.com/watch?v=4XVd0de9t-0,https://www.youtube.com/c/CodyMinati,8 months ago,"TCS Interview Process, TCS interview experience ,TCS interview questions , TCS interview questions for freshers 2022 , TCS ..."
"Don't become a Data Scientist in 2022, Instead 3 Roles for Better Career Path!",5.1K views,1littlecoder,https://www.youtube.com/watch?v=tU2X9swQcjs,https://www.youtube.com/c/1littlecoder,5 months ago,This is 2022 and I don't think Data Scientist is the sexiest job of the century anymore. In this video I try to explain WHY you should ...
"Learn Data Science Programming Language Python, Library: Pandas (Part#2)",21 views,Data Science Mastermind,https://www.youtube.com/watch?v=lLRhzEzpz84,https://www.youtube.com/c/DataScienceMastermind,2 days ago,"Data Science - Masterclass Propels You With Quantum Leap! A simple yet powerful ""6-step Data Science Apprenticeship ..."
Natural Language Processing In 5 Minutes | What Is NLP And How Does It Work? | Simplilearn,150K views,Simplilearn,https://www.youtube.com/watch?v=CMrHM8a3hqw,https://www.youtube.com/c/SimplilearnOfficial,1 year ago,"Ever wondered how we can talk to machines and have them answer back? That is due to the magic of NLP. In this video, we will ..."
Statistics for Data Science | Probability and Statistics | Statistics Tutorial | Ph.D. (Stanford),1.3M views,Great Learning,https://www.youtube.com/watch?v=Vfo5le26IhY,https://www.youtube.com/c/GreatLearningOfficial,2 years ago,Great Learning offers a range of extensive Data Science courses that enable candidates for diverse work professions in Data ...
Natural Language Processing  - What and Why|Natural Language Processing In Machine Learning|NLP,9.8K views,Unfold Data Science,https://www.youtube.com/watch?v=cs049uQWbpg,https://www.youtube.com/c/UnfoldDataScience,2 years ago,Natural Language Processing - What and Why|Natural Language Processing In Machine Learning|NLP ...
R Programming A-Z™: R For Data Science With Real Exercises! - learn R,48 views,Đống Xuân Huy,https://www.youtube.com/watch?v=rB2ELDP5_MI,https://www.youtube.com/channel/UCd5FLUqpWPXkDZC-uJpGuOg,1 year ago,Link to this course(special discount) https://www.udemy.com/course/r-programming/?
Top 10 Coursera Courses for Data Analysts,86K views,Alex The Analyst,https://www.youtube.com/watch?v=mLUzFXPPa4I,https://www.youtube.com/c/AlexTheAnalyst,1 year ago,LINKS TO ALL COURSES IN THE DESCRIPTION* Coursera is a fantastic platform to learn the skills you need to become a Data ...
R for Data Science A4 2021 Lecture 1,65 views,John Ostlund,https://www.youtube.com/watch?v=-FeyYOG29yA,https://www.youtube.com/channel/UCXQx6zboepjea7R0pwifD6w,1 year ago,Okay welcome to r for data science week one in this course we're going to be using the so-called tidy verse collection of packages ...
Staying Motivated in Data Science,11K views,Luke Barousse,https://www.youtube.com/watch?v=ZWqH5emDdOI,https://www.youtube.com/c/LukeBarousse,1 year ago,Ever feel like your data science goals are unachievable. Here is my tactic for dealing with failure and pushing through to succeed ...
How To Become a Data Engineer | Data Science Series 4 | America Lo Telugu Abbayi,38K views,America lo Telugu Abbayi,https://www.youtube.com/watch?v=8BpKIyS-yc8,https://www.youtube.com/c/AmericaloTeluguAbbayi,5 months ago,"Hello All, అందరికీ నమస్కారం , Welcome back to my channel అమెరికా లో తెలుగు అబ్బాయి."
Best Online Courses for Data Analysts,155K views,Alex The Analyst,https://www.youtube.com/watch?v=B2SPC3Wz1R8,https://www.youtube.com/c/AlexTheAnalyst,2 years ago,BEST ONLINE COURSES FOR DATA ANALYSTS | Today we look at some of my favorite courses for Data Analysts. These are ...
"Learn SQL For FREE 🔥 Best Resources - BEGINNER to ADVANCE 🔥 Data Engineer, Data Science, Analysts",50K views,E-Learning Bridge,https://www.youtube.com/watch?v=-g7YaHjl8ZE,https://www.youtube.com/c/LearningBridge,7 months ago,Discussed Questions: ✓ 0:00 -- SQL Importance ✓ 1:11 -- Crio QA Automation Program With Assured JOB ...
one quality for good data analyst and data scientist. #datascience #machinelearning #dataanalytics,1.2K views,Unfold Data Science,https://www.youtube.com/shorts/lVPgtZhvELI,https://www.youtube.com/c/UnfoldDataScience,8 months ago,Guys do you know what is the one quality that you have to develop to become a good data analyst and good data scientist well ...
R for Data Science: Relational data Part 1 (r4ds05 13),68 views,R4DS Online Learning Community,https://www.youtube.com/watch?v=4Ju9nj82Ksk,https://www.youtube.com/c/R4DSOnlineLearningCommunity,10 months ago,"Federica Gazzelloni presents the first half of Chapter 13 (""Relational data"") from R for Data Science by Hadley Wickham & Garrett ..."
How I Would Learn to be a Data Analyst,780K views,Luke Barousse,https://www.youtube.com/watch?v=CC66RXeTn_4,https://www.youtube.com/c/LukeBarousse,8 months ago,00:00 Intro 00:51How To Learn 2:50 Where To Start 3:55 Technical Skill Roadmap 6:36 Analytical Skills 8:31 Domain Knowledge ...
Stemming - Natural Language Processing With Python and NLTK p.3,185K views,sentdex,https://www.youtube.com/watch?v=yGKTphqxR9Q,https://www.youtube.com/c/sentdex,7 years ago,"Another form of data pre-processing with natural language processing is called ""stemming."" This is the process where we remove ..."
IBM Data Analyst Professional Certificate by Coursera | Is it Worth it?,74K views,Alex The Analyst,https://www.youtube.com/watch?v=eFDbE5Yunj0,https://www.youtube.com/c/AlexTheAnalyst,1 year ago,The IBM Data Analyst Professional Certificate is something I get asked about on a weekly basis. Is it worth taking? Will it help me ...
#Shorts: Why You Need To Trust Google's Machine Learning,122 views,IgniteVisibility,https://www.youtube.com/shorts/BI9TeN3xX8g,https://www.youtube.com/user/IgniteVisibility,18 hours ago,Are you team machine learning or set it up yourself? There's been a big push over the last 2 or 3 years from Google to let machine ...
How to get job in data science in tamil | Machine learning Tamil | Tips to get job with high CTC| AI,46K views,ABIN Channel,https://www.youtube.com/watch?v=bkJYwkjd9oQ,https://www.youtube.com/c/ABINChannel,9 months ago,How to get job for data science in tamil | Machine learning Tamil | Tips to get job with high CTC Relevel Apply Link: ...
Introduction to R Programming | 365 Data Science Courses,10K views,365 Data Science,https://www.youtube.com/watch?v=3scFDnDuT14,https://www.youtube.com/c/365DataScience,1 year ago,R is one of the best programming languages specifically designed for statistics and graphics. Programming in R is a fast and ...
Computer Vision for Spatial Analysis,3.2K views,Microsoft Developer,https://www.youtube.com/watch?v=n8ixE6ik9zQ,https://www.youtube.com/c/MicrosoftDeveloper,2 years ago,"Computer Vision is an Azure Cognitive Service which runs vision AI on images, and is a new feature of the Computer Vision ..."
Natural Language Understanding in Alexa,10K views,Amazon Web Services,https://www.youtube.com/watch?v=U1yT_4xcglY,https://www.youtube.com/c/amazonwebservices,2 years ago,"Presenter: Alan Packer, Director, Alexa Natural Language Understanding (NLU) Interpretations, Amazon It has taken decades for ..."
Build a Stock Trend Prediction Web App in Python | GeeksforGeeks,82K views,GeeksforGeeks,https://www.youtube.com/watch?v=s3CnE2tqQdo,https://www.youtube.com/c/GeeksforGeeksVideos,1 year ago,"In this video, we're going to discuss how to create a Stock Trend Prediction Web Application in Python. Here we will use Streamlit, ..."
AWS ML Dev Day - End-to-End Amazon SageMaker Pipeline with BERT - June 2021,4.4K views,DataScienceOnAWS,https://www.youtube.com/watch?v=R0dyrBQMAnQ,https://www.youtube.com/channel/UCvlZKtekcKkBUuz8f9dhobw,1 year ago,"Build an End-To-End Pipeline With BERT, Tensorflow, and Amazon SageMaker June 28, 2021 | 9:00 AM - 1:00 PM PT About the ..."
Data Scientist vs Data Analyst (funny!),312K views,Luke Barousse,https://www.youtube.com/watch?v=_r655ogzK4A,https://www.youtube.com/c/LukeBarousse,1 year ago,... Courses: Google Data Analytics Certificate (START HERE) https://lukeb.co/GoogleCert SQL for Data Science ...
Data Analyst vs Data Scientist | Data Analyst vs Data Scientist job| Unfold data science,2.7K views,Unfold Data Science,https://www.youtube.com/watch?v=KW_wZltoII4,https://www.youtube.com/c/UnfoldDataScience,3 years ago,Data Analyst vs Data Scientist | Data Analyst vs Data Scientist job| Unfold data science #DataScience #UnfoldDataScience ...
Non Programmer To Data Analyst Or Data Scientist?Which Is Best To Get In Analytics Industry Quickly,27K views,Krish Naik,https://www.youtube.com/watch?v=NtFY4ScOEAE,https://www.youtube.com/user/krishnaik06,1 year ago,Subscribe my vlogging channel https://www.youtube.com/channel/UCjWY5hREA6FFYrthD0rZNIw Please donate if you want to ...
Fix this before you choose Data Science! #datascientist #shorts #developer #programming,518K views,BEPEC - Career Transition Simplified,https://www.youtube.com/shorts/MkooBL3tmyM,https://www.youtube.com/c/BEPEC,1 year ago,Looking for career guidance and Hike Guaranteed Career Transition Programs? Join our Career Transition Programs. Register ...
R For Data Science Full Course | Data Science With R Full Course |Data Science with R -Part-12,56 views,KSR Datavizon ,https://www.youtube.com/watch?v=Srcy06DSuz8,https://www.youtube.com/c/KSRDatavizon,1 year ago,"In this video on R for Data Science Full Course, we'll start by learning data science from introduction video. You will then learn the ..."
R For Data Science Full Course | Data Science With R Full Course |Data Science with R -Part-6,150 views,KSR Datavizon ,https://www.youtube.com/watch?v=DBpIIeqXkkM,https://www.youtube.com/c/KSRDatavizon,1 year ago,"In this video on R for Data Science Full Course, we'll start by learning data science from introduction video. You will then learn the ..."
SQL for data Analysis | Customer Analysis with practical examples | SQL CTE and Subquery,535 views,BI Insights Inc,https://www.youtube.com/watch?v=P-o01tL2myg,https://www.youtube.com/c/HaqNawaz,4 months ago,"SQL tutorial for beginners - Learn SQL, the world's widely used language for data analysis and manipulation. Focus in this video: ..."
Data Science Salary 2022 | South Africa,7.7K views,Brilliant Academic,https://www.youtube.com/watch?v=9Yz-5fIdzYI,https://www.youtube.com/channel/UCUXlDg5l1RvgYwayN59MW0Q,1 year ago,How much Data Scientists make in South Africa as at January 2021.
How to choose between software engineering and data science | 5 Key Considerations,332K views,Tina Huang,https://www.youtube.com/watch?v=JUkSeqe1eYQ,https://www.youtube.com/c/TinaHuang1,2 years ago,"Software Engineering vs Data Science? Last year, I made a choice between a software engineering and a data science position."
Natural Language Processing: An Introduction,2K views,SAS Users,https://www.youtube.com/watch?v=wS0X1bSsuUU,https://www.youtube.com/c/sasusers,1 year ago,"This talk highlights the importance of text data in data analysis projects, particularly within medical and legal contexts."
SQL Interview Questions From MICROSOFT | Expensive Projects (Data Science Interview Questions),2.9K views,StrataScratch,https://www.youtube.com/watch?v=iR8FDQyCtnw,https://www.youtube.com/channel/UCW8Ews7tdKKkBT6GdtQaXvQ,1 year ago,This SQL data science interview question was asked by Microsoft. I'll cover both the question and answer and give a detailed ...
A Day In The Life Of A Data Science Manager,38K views,Recall by Dataiku,https://www.youtube.com/watch?v=2lus1TtdB_M,https://www.youtube.com/c/RecallbyDataiku,10 months ago,Learn more about the Dataiku platform: https://www.dataiku.com/ Twitter: https://twitter.com/dataiku Instagram: ...
Data Analytics Using R | Introduction To Data Analytics | Data Analytics For Beginners | Simplilearn,54K views,Simplilearn,https://www.youtube.com/watch?v=I4NRCN9DPTI,https://www.youtube.com/c/SimplilearnOfficial,2 years ago,"In this Data Analytics Using R video, you will receive an introduction to data analytics. Here, you will understand why and what ..."
Introduction | NLP Tutorial For Beginners In Python  -  1,100K views,codebasics,https://www.youtube.com/watch?v=R-AG4-qZs1A,https://www.youtube.com/c/codebasics,8 months ago,We are starting an Natural Language Processing tutorial for beginners series in Python. In this introduction video we will discuss ...
"Reality behind data science, machine learning jobs",536K views,codebasics,https://www.youtube.com/shorts/R6u5EBWAssY,https://www.youtube.com/c/codebasics,7 months ago,Reality behind data science jobs. Is machine learning really cool? Do you want to learn technology from me?
10 Yrs Experienced in Banking & Finance Still Learning Excel - SQL - Tableau & Power BI,2.9K views,Data Science Career Coach,https://www.youtube.com/watch?v=Ebdglb376UY,https://www.youtube.com/c/datascience,1 year ago,10 Yrs Experienced in Banking & Finance Still Learning Excel - SQL - Tableau & Power BI.
Question Generation Using Natural Language Processing,13K views,AIEngineering,https://www.youtube.com/watch?v=hoCi_bJHyb8,https://www.youtube.com/c/AIEngineeringLife,Streamed 1 year ago,datascience #nlp #transformers In this webinar Ramsri Goutham will be walking us on how to generate assessments in Edtech ...
Natural Language Processing (NLP) Chatbot,12K views,Xccelerate,https://www.youtube.com/watch?v=UkODQwZABSA,https://www.youtube.com/channel/UCsaPLqJeTBIEcaLYi72gHnQ,Streamed 3 years ago,"The hands-on tutorial focuses on understanding what is natural language processing, emerging trends and applications of NLP in ..."
R for Data Science: Data Visualization (r4ds06 2 3),253 views,R4DS Online Learning Community,https://www.youtube.com/watch?v=5IMg8AC-1IA,https://www.youtube.com/c/R4DSOnlineLearningCommunity,11 months ago,"Adeyemi Olusola presents chapters 2-3 (""Data Visualization"") from R for Data Science by Hadley Wickham & Garrett Grolemund ..."
Natural Language Processing In 10 Minutes | NLP Tutorial For Beginners | NLP Training | Edureka,608K views,edureka!,https://www.youtube.com/watch?v=5ctbvkAMQO4,https://www.youtube.com/c/edurekaIN,3 years ago,Subscribe to our channel to get video updates. Hit the subscribe button above.
FREE RESOURCES TO LEARN MACHINE LEARNING🔥 | Learn AI/ML/DL for FREE!,61K views,Ishan Sharma,https://www.youtube.com/watch?v=flVKdQDfnj0,https://www.youtube.com/c/IshanSharma7390,1 year ago,Here are a list of free resources for you to learn machine learning. I've shown resources that I used to learn machine learning and ...
Natural Language Processing | Briefly Explained in Tamil | SRM VEC CSI'AN,130 views,SRM VEC CSI'AN,https://www.youtube.com/watch?v=baYKgj-iea4,https://www.youtube.com/c/SRMVECCSIAN,6 months ago,"Natural language processing (NLP) is a subfield of linguistics, computer science, and artificial intelligence concerned with the ..."
Data Science on AWS - Workshop - May 2021,8K views,DataScienceOnAWS,https://www.youtube.com/watch?v=sL8wpFo7LaQ,https://www.youtube.com/channel/UCvlZKtekcKkBUuz8f9dhobw,1 year ago,"Workshop: Build an AI/ML pipeline with BERT, TensorFlow and Amazon SageMaker RSVP: ..."
Tableau for Data Science and Data Visualization - Crash Course Tutorial,660K views,freeCodeCamp.org,https://www.youtube.com/watch?v=TPMlZxRRaBQ,https://www.youtube.com/c/Freecodecamp,3 years ago,"Learn to use Tableau to produce high quality, interactive data visualizations! Tableau can help you see and understand your data."
TensorFlow Tutorial 2022,20K views,Derek Banas,https://www.youtube.com/watch?v=Y__gyApx_7c,https://www.youtube.com/c/derekbanas,Streamed 4 months ago,I'll teach a ton about how to use TensorFlow and I'll answer all your questions live. I'll cover all of the following and much more ...
AI VS ML VS DL VS Data Science,2.3M views,Krish Naik,https://www.youtube.com/watch?v=k2P_pHQDlp0,https://www.youtube.com/user/krishnaik06,2 years ago,Please do subscribe my vlogging channel for motivational videos ...
Computer Vision Made Easy!,3.7K views,Microsoft Developer,https://www.youtube.com/watch?v=tQ7ZEF76BuQ,https://www.youtube.com/c/MicrosoftDeveloper,3 years ago,"Computer Vision made easy: from pre-trained models to custom ones, Cognitive Services has you covered. Join Kelly Freed, PM ..."
Python Data Analysis/ IMDB Movie Descriptions / Natural Language Processing,342 views,DataGirl,https://www.youtube.com/watch?v=Ayn9HARDLzY,https://www.youtube.com/c/DataGirl123,1 year ago,This video is an introduction to Natural Language Processing applied to movie descriptions from #IMDB. I will explain the required ...
The #1 Thing to Avoid in Behavioral Interviews | Data Science Interviews,168 views,Data Interview Pro,https://www.youtube.com/shorts/sBtplMllcrY,https://www.youtube.com/c/DataInterviewPro,2 hours ago,shorts Here's my top tip for handling the behavioral portion of your Data Science interview. ✏️ Product case interview cheat ...
"Coffee Chat: Machine Learning & Natural Language Processing (June 9 - June 16, 2022)",243 views,Rachael Tatman,https://www.youtube.com/watch?v=6eMyX9Dxcw8,https://www.youtube.com/c/RachaelTatmanNLP,Streamed 3 months ago,"Join me for a chill live-stream where we chat about the last week in machine learning and NLP including: new products, software ..."
What Does A Machine Learning Engineer At Amazon Do?,85K views,Clément Mihailescu,https://www.youtube.com/watch?v=opb2Bq4Qvyo,https://www.youtube.com/channel/UCaO6VoaYJv4kS-TQO_M-N_g,1 year ago,"In this video, I sat down with Ryan Doan, an ex-Amazon Machine Learning Engineer and the creator of MLExpert, to talk about ..."
