Video_Title,Total_Views,Channel_Name,Video_Link,Channel_Link,Publish_Date,Description
R For Data Science Full Course | Data Science With R Full Course in 1 Hours,5 views,Anuj Sharma,https://www.youtube.com/watch?v=om9X8hyGYMc,https://www.youtube.com/user/anujsharmaofficial,10 months ago,RForDataScience #DataScienceWithR #DataScienceWithRFullCourse In this video on Fundamentals of R for Data Science Full ...
Natural Language Processing with TensorFlow 2 - Beginner's Course,74K views,freeCodeCamp.org,https://www.youtube.com/watch?v=B2q5cRJvqI8,https://www.youtube.com/c/Freecodecamp,2 years ago,This course is a practical introduction to natural language processing with TensorFlow 2.0. In this tutorial you will go from having ...
10 raisons de ne PAS devenir Data Scientist.,34K views,Defend Intelligence,https://www.youtube.com/watch?v=jmECuuw28wI,https://www.youtube.com/c/DefendIntelligence-tech,5 months ago,"Je vous parle VRAIMENT du métier de Data Scientist, le métier au centre du développement de l'Intelligence Artificielle en ..."
Natural language processing - Qlik Sense,1.3K views,Qlik Help,https://www.youtube.com/watch?v=0L7Uu4q7gsw,https://www.youtube.com/c/QlikHelp-Videos,2 years ago,"Starting from Qlik Sense February 2020, we have improved Natural language processing in the Qlik cognitive engine with better ..."
Discover our Data Analyst training - DataScientest,820 views,DataScientest,https://www.youtube.com/watch?v=VQ4WAPP3cVs,https://www.youtube.com/c/DataScientest,1 month ago,How to become a Data Analyst ? Discover our curriculum ! A Data Analyst processes data to extract information to address ...
Why I Left Data Engineering for Data Science,54K views,Sundas Khalid,https://www.youtube.com/watch?v=wN_eu04kXhk,https://www.youtube.com/c/SundasKhalid,10 months ago,"Hi friends, today I am sharing 3 reasons why I left data engineering. Let me know in comments if any of this resonated with you."
Full Stack Developer vs Data Analyst - Which is the better Career Option? Fresher Average Salary,24K views,Abhishek Agarrwal,https://www.youtube.com/watch?v=CsyohE-DcEQ,https://www.youtube.com/c/AbhishekAgarrwal,11 months ago,"Received this query on whether full stack developer a better career option or data analyst and after gathering some information, ..."
Learn Python in Arabic #142 - Numpy - Intro,25K views,Elzero Web School,https://www.youtube.com/watch?v=AFIaWjcUgW8,https://www.youtube.com/c/ElzeroInfo,2 years ago,Numpy - Intro https://elzero.org/category/courses/mastering-python/ ============================= Support Me on Patreon ...
Data Analytics Full Course 2022 | Data Analytics For Beginners | Data Analytics Course | Simplilearn,375K views,Simplilearn,https://www.youtube.com/watch?v=CaqJ65CIoMw,https://www.youtube.com/c/SimplilearnOfficial,Streamed 8 months ago,What is Data Analytics Data Analytics for Beginners Data Analytics Using Phyton Top 10 skills to become a Data analyst in 2022 ...
Machine Learning Algorithms | Machine Learning Tutorial | Data Science Algorithms | Simplilearn,298K views,Simplilearn,https://www.youtube.com/watch?v=I7NrVwm3apg,https://www.youtube.com/c/SimplilearnOfficial,4 years ago,"Boost your career with Simplilearn's 6-months Data Science Job Guarantee Program with a placement, guarantee! Land your ..."
"Making Machine Learning more accessible | Sebastian Raschka, Lead AI Educator, Grid.ai",758 views,Jay Shah,https://www.youtube.com/watch?v=tC2jzliedYQ,https://www.youtube.com/c/JayShahml,5 months ago,"Sebastian Raschka is the lead AI educator at GridAI. He is the author of the book ""Machine Learning with PyTorch and Scikit ..."
Become a DATA ANALYST with NO degree?!? The Google Data Analytics Professional Certificate,3.7M views,Luke Barousse,https://www.youtube.com/watch?v=fmLPS6FBbac,https://www.youtube.com/c/LukeBarousse,1 year ago,00:00 Intro 01:28 Course Overview 03:31 Courses & Tools 05:52 Likes & Concerns 08:48 Recommendation 10:31 Closing As a ...
Python For & While Loops for Data Science / Data Analysis - P.3,3.8K views,Luke Barousse,https://www.youtube.com/watch?v=NnfbVOt9IR0,https://www.youtube.com/c/LukeBarousse,1 year ago,This video provides and overview of how loops (for and while) are used by data scientist and data analysts. In this tutorial we take ...
Natural Language Processing | Robotic Process Automation | How it Works | NLP Use Case,569 views,DMSSolutions,https://www.youtube.com/watch?v=QJchgX_ebkU,https://www.youtube.com/user/DMSSolutions,3 years ago,NLP Use Case: How it works? Use Case developed by DMS Solutions showcasing on how NLP engine works. About DMS ...
Eye  Safety - The 20/20/20 Rule - Computer Vision Syndrome,68K views,Safety Memos,https://www.youtube.com/watch?v=_7hwZv36JMU,https://www.youtube.com/c/SafetyMemos,8 years ago,EYE SAFETY - The 20/20/20 Rule - PREVENT COMPUTER VISION SYNDROME Working on a computer can put great strain on ...
R For Data Science Full Course | Data Science With R Full Course |Data Science with R -Part-22,43 views,KSR Datavizon ,https://www.youtube.com/watch?v=yg5eQ3C6QSk,https://www.youtube.com/c/KSRDatavizon,1 year ago,"In this video on R for Data Science Full Course, we'll start by learning data science from introduction video. You will then learn the ..."
Fuzzy String Matching in Natural Language Processing | NLP,197 views,Rohan-Paul-AI,https://www.youtube.com/watch?v=_IGdekeBCoE,https://www.youtube.com/c/RohanPaul-AI,3 months ago,---------------- Checkout my Generative Adversarial Network (GAN) video course in Gumroad - 7.5 Hours of Course - 6 different ...
Web Developer VS Data Scientist | Detailed Comparison between Web Development and Data Science,7.7K views,Coding for All | Newton School,https://www.youtube.com/watch?v=c1Na590Fyqk,https://www.youtube.com/channel/UCjcju-aD_ZcWxiXF5lvqntg,1 month ago,"Web Developer VS Data Scientist | Detailed Comparison between Web Development and Data Science - In this video, Abhijeet ..."
Learn Power BI for Data Science,14K views,EC Analytics Consulting,https://www.youtube.com/watch?v=xJ9DgtQztcE,https://www.youtube.com/channel/UCuBU2fjBXsTd5ASzaokCv6Q,2 years ago,Enroll to Learn Microsoft Power BI for Data Science https://www.udemy.com/course/learn-microsoft-power-bi-for-data-science/?
Mediapipe Installation & Introduction | Face & Hand Landmark Example with Python,10 views,Computer Vision Lab,https://www.youtube.com/watch?v=w4r8oEOsU54,https://www.youtube.com/channel/UC42P32x5XVhvTqznD3bThjQ,1 hour ago,"Mediapipe is invented by Google. It has many ML(machine learning) solutions inside like hand tracking, face detection, pose ..."
Build a Parking Space Recognition system with Computer Vision,3.1K views,Pysource,https://www.youtube.com/watch?v=k41eUw-BSBk,https://www.youtube.com/channel/UC5hHNks012Ca2o_MPLRUuJw,2 weeks ago,"In today's video we're going to talk about how to build a Parking space Recognition system that works in a real world scenario, ..."
Learn Data Science step by step in Hindi | Data Science Tutorial for Beginners | Great Learning,139K views,Great Learning,https://www.youtube.com/watch?v=N2UPlYHmvmk,https://www.youtube.com/c/GreatLearningOfficial,1 year ago,"To keep up with the ever-evolving aspects of data and its domains, data handling and analysis have become crucial to ..."
R for Data Science: Workflow: basics (r4ds07 4),44 views,R4DS Online Learning Community,https://www.youtube.com/watch?v=LsU9XZ8iNws,https://www.youtube.com/c/R4DSOnlineLearningCommunity,3 days ago,"Dolleen Osundwa presents Chapter 4 (""Data transformation"") from R for Data Science (2e) by Hadley Wickham, Mine ..."
SQL for Data Science Tutorial | Data Science Training | Edureka | DS Rewind - 1,4.8K views,edureka!,https://www.youtube.com/watch?v=zBQh7szoyJM,https://www.youtube.com/c/edurekaIN,7 months ago,"This Edureka session on SQL for Data Science will help you understand how SQL can be used to store, access and retrieve data ..."
Top 8 skills you need to be a Data Scientist I INSAID,147 views,INSAID,https://www.youtube.com/watch?v=qj8naqr_hdo,https://www.youtube.com/c/INSAID1,8 days ago,"Data Scientist is one of the fastest-growing jobs in recent years. It's an exciting and highly paid career, that presents you with tons ..."
SQL for Data Science #1: Introduction to SQL,2.3K views,Xowl,https://www.youtube.com/watch?v=7NSr6C8IhCo,https://www.youtube.com/channel/UCvIHnJ8croj_v2fx_ZXuTlw,4 years ago,In this video I present a short introduction to SQL focused on SQL for data science. I explain several SQL concepts and show ...
All Machine Learning Models Explained in 5 Minutes | Types of ML Models Basics,633K views,Learn with Whiteboard,https://www.youtube.com/watch?v=yN7ypxC7838,https://www.youtube.com/c/AmarpreetSingh25,2 years ago,"Confused about understanding machine learning models? Well, this video will help you grab the basics of each one of them."
Live Q&A-Ask Anything Related To Data Science,8K views,Krish Naik,https://www.youtube.com/watch?v=Hgjax-GPsAw,https://www.youtube.com/user/krishnaik06,Streamed 22 hours ago,Just 2 days left for the Data Science Industry Ready Projects Course. In this course we will be learning how to implement end to ...
Data science roadmap: What skills you should learn first?,335K views,Sundas Khalid,https://www.youtube.com/watch?v=ylOILe-Sc-w,https://www.youtube.com/c/SundasKhalid,1 year ago,"Hi friends, in today's video I am sharing my self-taught data science roadmap and first skill you should learn as well as learnings ..."
UiPath AI Computer Vision - #Training,48K views,UiPath,https://www.youtube.com/watch?v=DRjvbtsdbdM,https://www.youtube.com/c/UiPath,3 years ago,Join our community for more updates: Blog - https://www.uipath.com/blog LinkedIn - https://www.linkedin.com/company/uipath/ ...
What is Computer Vision,1K views,alwaysAI,https://www.youtube.com/watch?v=neuAOEaJl6E,https://www.youtube.com/channel/UCtOaFDjfZQ_Gqa_MogHDuow,2 years ago,New to computer vision development? This video will familiarize you with high level concepts and common techniques to start ...
Practice Writing SQL Queries using Real Dataset(Practice Complex SQL Queries),75K views,techTFQ,https://www.youtube.com/watch?v=XruOBp7yPXU,https://www.youtube.com/c/techTFQ,10 months ago,"In this video, let's learn to write SQL Queries using a real dataset downloaded from the internet. We shall download Olympics ..."
R for data science book club chapter 1 | a quick introduction of the book| whole process,931 views,Data Science with Yan,https://www.youtube.com/watch?v=v-97CyaTLx4,https://www.youtube.com/channel/UCf3hRwWWz-2HxdMdwOWVpow,1 year ago,"This is a quick introduction chapter, chapter 1, of the book: R for data science. You may read chapter 1 through this link: ..."
Top 10 Data Analysis Tools | Top Data Analytics tools | Data Analytics | Simplilearn,90K views,Simplilearn,https://www.youtube.com/watch?v=mccsmoh2_3c,https://www.youtube.com/c/SimplilearnOfficial,Streamed 2 years ago,"This Post Graduate Program in Data Analytics, in partnership with Purdue University and in collaboration with IBM, will make you ..."
How I Would Learn Data Science in 2022,151K views,Recall by Dataiku,https://www.youtube.com/watch?v=Rt6eb9VOFII,https://www.youtube.com/c/RecallbyDataiku,7 months ago,"In this video, I go through how I would learn data science in 2022. Tina's channel: https://youtube.com/c/TinaHuang1 Learn more ..."
Learn how to SOLVE a data analytics case study problem,20K views,Data Science Jay,https://www.youtube.com/watch?v=sjub3tYLHDc,https://www.youtube.com/c/DataScienceJay,8 months ago,"Today I'm tackling a data analytics problem asked in data engineering and data science interviews. For most of these questions, ..."
Top 5 Computer Vision Interview Questions (Data Science),13K views,Abhishek T,https://www.youtube.com/watch?v=iJPnpme0LRQ,https://www.youtube.com/channel/UCch0bGd63dgKYASSJM0EWXg,2 years ago,This video contains few important interview questions for Computer Vision.
Natural Language Processing Concepts and Workflow,4.9K views,Women Who Code,https://www.youtube.com/watch?v=WjgFBmPG1Ng,https://www.youtube.com/c/WomenWhoCodeGlobal,2 years ago,Presented by WWCode Data Science ‍   Speaker: Rishika Singh ✓ Topics: Natural Language Processing Concepts and ...
🔥Data Science Full Course 2022 | Data Science | Data Science For Beginners | Simplilearn,286K views,Simplilearn,https://www.youtube.com/watch?v=xvEKQefqQ7A,https://www.youtube.com/c/SimplilearnOfficial,Streamed 8 months ago,"Boost your career with Simplilearn's 6-months Data Science Job Guarantee Program with a placement, guarantee! Land your ..."
datascience@berkeley | Natural Language Processing with Deep Learning,4.6K views,datascience@berkeley,https://www.youtube.com/watch?v=-xPIvnYpqKQ,https://www.youtube.com/user/BerkeleyDataScience,5 years ago,Hi I'm Koosman welcome to our course a natural language processing so hopefully you all remember me from the machine ...
Building a Machine Learning API in 15 Minutes | Coding Challenge,20K views,Nicholas Renotte,https://www.youtube.com/watch?v=C82lT9cWQiA,https://www.youtube.com/c/NicholasRenotte,1 month ago,"What's happening guys, welcome to the first episode of CodeThat! In this ep I try to build a machine learning API at freaking light ..."
R for Data Science – Exploring the Tidyverse - Olof Rännbäck Garpinger,305 views,FooCafe,https://www.youtube.com/watch?v=wtoI4_UrOo0,https://www.youtube.com/c/FooCafeOrgMalmo,4 years ago,"R is a programming language and free software environment used by companies such as Google, Microsoft, and New York Times ..."
Why R? 2020 Keynote - Riinu Pius - R for Health Data Science,1K views,Why R? Foundation,https://www.youtube.com/watch?v=O4SxU7cRDpI,https://www.youtube.com/c/WhyRFoundationVideos,Streamed 1 year ago,Title: R for Health Data Science: from clinicians who code to Shiny interventions Riinu Pius is a data scientist at the Centre for ...
"Count plants with a Drone, AI and Computer Vision | Does it really work?",9.5K views,Pysource,https://www.youtube.com/watch?v=jTgc87HeAcw,https://www.youtube.com/channel/UC5hHNks012Ca2o_MPLRUuJw,1 year ago,"Have you ever thought about applying AI and Computer Vision to the Agriculture industry? In this video, I show you the 4 main ..."
Cindy Butler - Expert Statistician on  ElectionFr@*ud in Utah & Other States,449 views,Latter-Day Media - Come Follow Christ,https://www.youtube.com/watch?v=1FzFgymCtxc,https://www.youtube.com/c/ComeFollowMeLatterDayMedia,21 hours ago,"Cindy Butler is a Statistician, Data Scientist, and Sr Consultant with an Masters Degree in Statistics from Brigham Young ..."
Step-by-Step Natural Language Processing Workshop: From Data to Deployment,10K views,DeepLearningAI,https://www.youtube.com/watch?v=D9hY8pZe7hk,https://www.youtube.com/c/Deeplearningai,Streamed 10 months ago,"Join us for a live, interactive workshop on how to build and deploy a virtual chatbot using Natural Language Processing (NLP)."
Stemming in Natural Language Processing,36 views,AI Next Generation,https://www.youtube.com/watch?v=cL9awpvj_9Y,https://www.youtube.com/channel/UCZUUitv-us8zJ0_JyKM-bqg,10 months ago,In this video you will learn about stemming in NLP and different types of technique in stemming i.e. 1- Porter Stemmer 2- ...
Introduction to R,42K views,Data Science for Engineers IITM,https://www.youtube.com/watch?v=79n3hzNclJo,https://www.youtube.com/channel/UCifB-UuE1p7fIhpc9YPON_A,4 years ago,Data science for Engineers Executing R files – Summary • Run can be used to execute selected lines • Source/ Source with echo ...
Natural Language Processing,2.1K views,Esri Events,https://www.youtube.com/watch?v=LTG6iZnaYdg,https://www.youtube.com/c/EsriEvents,2 years ago,"arcgis.learn is a new Python module for ArcGIS that provides many deep learning capabilities. In this video, we demonstrate how ..."
Machine Learning Interview Questions and Answers | Machine Learning Interview Preparation | Edureka,245K views,edureka!,https://www.youtube.com/watch?v=t6gOpFLt-Ks,https://www.youtube.com/c/edurekaIN,4 years ago,1. Machine Learning Core Interview Question 2. Machine Learning using Python Interview Question 3. Machine Learning ...
❌ How Much SQL Do You NEED TO KNOW as a Data Scientist ❌ Do You Really Have to Learn SQL in 2021,3.8K views,DecisionForest,https://www.youtube.com/watch?v=U1V-BRw-kqI,https://www.youtube.com/c/DecisionForest,1 year ago,Let's talk about whether SQL is necessary to learn before learning Python when you start your data science journey. Also let's see ...
Natural Language Processing Interview Questions & Answers | Crack NLP Interview | Great Learning,7.9K views,Great Learning,https://www.youtube.com/watch?v=zchbiQSAL3o,https://www.youtube.com/c/GreatLearningOfficial,1 year ago,"Confidently answer some of the most common NLP interview questions! Interviews are unpredictable, and it becomes essential to ..."
The Last Advanced SQL Tutorial You Will Ever Need To Watch As A Data Scientist Or Engineer,11K views,Seattle Data Guy,https://www.youtube.com/watch?v=dyfQoklmjAk,https://www.youtube.com/c/SeattleDataGuy,1 year ago,SQL is becoming a common skill requirement across industries. Companies like Amazon and Google often will require their data ...
Machine Learning Roadmap for Beginners,150K views,Ayush Singh,https://www.youtube.com/watch?v=Av0oMG49FQE,https://www.youtube.com/c/AyushSinghSh,1 month ago,Hey Guys! This video cover Machine Learning Roadmap for Beginners to Advance level with Resources. Tells Essential topics to ...
What is Pandas? Why and How to Use Pandas in Python,483K views,Python Programmer,https://www.youtube.com/watch?v=dcqPhpY7tWk,https://www.youtube.com/c/FlickThrough,4 years ago,"This is a short explainer video on pandas in python. I tell you what pandas is, why it's used and give a couple of tutorials on how to ..."
SQL Tutorial For Beginners In Hindi | DBMS Tutorial | SQL Full Course In Hindi | Great Learning,2.4M views,Great Learning,https://www.youtube.com/watch?v=1dWCqjhvF58,https://www.youtube.com/c/GreatLearningOfficial,2 years ago,00:36:06 - Why SQL? 00:36:54 - SQL Terms 00:37:48 - SQL Data Types 00:39:38 - SQL Constraints 00:42:50 - SQL Command ...
Important interview questions for Data scientist. |Data Analyst | Machine Learning,227 views,DS Bridge,https://www.youtube.com/watch?v=cXfEUAENyWE,https://www.youtube.com/channel/UCO3crF7bFpgqyVx-BBNGg9w,11 months ago,"In this video, we will discuss more than 5 questions and this will be 4th part of this playlist. If you face any difficulties understanding ..."
SQL is a Data Analyst's Best Friend | Google Data Analytics Certificate,5.2K views,Google Career Certificates,https://www.youtube.com/watch?v=FkwjNtPC7N0,https://www.youtube.com/c/GoogleCareerCertificates,1 year ago,"Advertising agencies need to make reports for their clients and Sally, a Measurement and Analytical Lead at Google, helps them ..."
R For Data Science Full Course | Data Science With R Full Course |Data Science with R -Part-19,57 views,KSR Datavizon ,https://www.youtube.com/watch?v=JsxL2gVD8BU,https://www.youtube.com/c/KSRDatavizon,1 year ago,"In this video on R for Data Science Full Course, we'll start by learning data science from introduction video. You will then learn the ..."
FREE Data Science Online Courses with FREE certificate,501K views,Etisha Garg,https://www.youtube.com/watch?v=XOgx6OyGF1Y,https://www.youtube.com/c/EtishaGarg,2 years ago,FREE Data Science Online Courses with FREE certificate This video is about the data science courses which are completely free ...
Natural Language Processing: Tutorial 1 - How To Create New Environment in Anaconda (python),301 views,[Robotics] [AI] [ML] RAM,https://www.youtube.com/watch?v=Jgq2dbPbjzw,https://www.youtube.com/channel/UCPbP3SrgDG6dWxJrMXTWuNw,1 year ago,The learning objective of this lecture is mainly focused on the creation of a new environment in Anaconda (python). And illustrated ...
ArcGIS API for Python: Analysts and Data Science,1.4K views,Esri Events,https://www.youtube.com/watch?v=UUotEDEVySs,https://www.youtube.com/c/EsriEvents,2 years ago,Python has positioned itself as a highly suitable programming/scripting language for data exploration and analysis with its rich ...
Data Analyst Portfolio | GREAT Examples!,51K views,Ali Ahmad,https://www.youtube.com/watch?v=1T7ExqKejFg,https://www.youtube.com/c/AliAhmad1987,1 year ago,I share some example of some great data analyst portfolios that I hope can be of some inspiration to showcase data analysis skills ...
Data Analysis with Python Course: Part 1 of 6 (हिंदी में),169K views,freeCodeCamp Hindi,https://www.youtube.com/watch?v=YV0_puRO1u4,https://www.youtube.com/channel/UClHVZQqHLfbcbwFDwPfdB-A,2 years ago,"'Data Analysis with Python: Zero to Pandas' एक उपयोगी, कोडिंग-केंद्रित कोर्स है जो कि ..."
Watch this BEFORE buying a LAPTOP for Machine Learning in 2022 🦾,43K views,Jesper Dramsch – Real-world Machine Learning,https://www.youtube.com/watch?v=LHiM0WnRaD8,https://www.youtube.com/c/JesperDramsch,1 year ago,"Machine learning on a laptop, is that even possible? How about Macbooks? What hardware do I need? What should I spend?"
[SAIF2020] Day2: Natural Language Processing - Christopher Manning | Samsung,11K views,Samsung,https://www.youtube.com/watch?v=Tmwytgz0qwk,https://www.youtube.com/c/Samsung,1 year ago,Session 1. Natural Language Processing “Natural Language Understanding and Conversational AI” Natural language processing ...
Become a DATA ANALYST with NO degree?!? The Google Data Analytics Professional Certificate,3.7M views,Luke Barousse,https://www.youtube.com/watch?v=fmLPS6FBbac,https://www.youtube.com/c/LukeBarousse,1 year ago,... Courses: Google Data Analytics Certificate (START HERE) https://lukeb.co/GoogleCert SQL for Data Science ...
Data Science Career: (Is Becoming A Data Scientist ACTUALLY Worth It?),72K views,Shane Hummus,https://www.youtube.com/watch?v=O9nf1CqjGzI,https://www.youtube.com/c/ShaneHummus,6 months ago,---------- These videos are for entertainment purposes only and they are just Shane's opinion based off of his own life experience ...
Target Data Science roles without any prior experience,142 views,Pavan Sathiraju,https://www.youtube.com/watch?v=3j6ASvhP_WM,https://www.youtube.com/c/PavanSathiraju,22 hours ago,"In this video - I analyzed 3 job descriptions (Microsoft, American Express, and Accenture). While the Microsoft one requires prior ..."
Google Data Analytics Certificate #shorts,93K views,Sundas Khalid,https://www.youtube.com/shorts/JGnkEoFLpEs,https://www.youtube.com/c/SundasKhalid,1 year ago,Google Data Analytics Certificate: https://coursera.pxf.io/doq6yy.
Natural Language Processing,179 views,Usable Privacy Policy Project,https://www.youtube.com/watch?v=L-Ip7F96mbo,https://www.youtube.com/channel/UCYz4AuQSLW8htz0anZMbPOQ,4 years ago,
Live Day 1- Introduction To statistics In Data Science,327K views,Krish Naik,https://www.youtube.com/watch?v=11unm2hmvOQ,https://www.youtube.com/user/krishnaik06,Streamed 7 months ago,The Oneneuron Lifetime subscription has been extended. In Oneneuron platform you will be able to get 100+ courses(Monthly ...
How I use Excel as a Data Analyst,313K views,Luke Barousse,https://www.youtube.com/watch?v=lw6sPHH7twk,https://www.youtube.com/c/LukeBarousse,4 months ago,"As a member of the Amazon, Coursera, Hostinger, Parallels, Interview Query, and Data Camp Affiliate Programs, I earn a ..."
Walmart Data Science Case Study Mock Interview: Underpricing Algorithm,38K views,Data Science Jay,https://www.youtube.com/watch?v=LHt0EFIGZNs,https://www.youtube.com/c/DataScienceJay,2 years ago,Today I am back with Shashank tackling a Walmart data science and machine learning case study interview question.
Work Week in My Life as a Data Scientist,532K views,juliafei,https://www.youtube.com/watch?v=yfLczGFw-ok,https://www.youtube.com/c/juliafei,1 year ago,"Hi Friends, In this video, I'll share with you what a typical work week is for me. I like keeping myself really busy (what a masochist ..."
What is Natural Language Processing?,806 views,AssemblyAI,https://www.youtube.com/watch?v=ZifynN2oyhs,https://www.youtube.com/c/AssemblyAI,6 months ago,"In this video, we learn what natural language processing is. Sometimes referred to as NLP, it is the subdiscipline of AI that has ..."
Complete Machine Learning In 6 Hours| Krish Naik,149K views,Krish Naik,https://www.youtube.com/watch?v=JxgmHe2NyeY,https://www.youtube.com/user/krishnaik06,3 months ago,00:00:00 Introduction 00:01:25 AI Vs ML vs DL vs Data Science 00:07:56 Machine LEarning and Deep Learning 00:09:05 ...
RoadMap With Minimal Skills To Become Data Analyst In 2022,399K views,Krish Naik,https://www.youtube.com/watch?v=lzP14izI4lQ,https://www.youtube.com/user/krishnaik06,8 months ago,In this video we will discuss about the roadmap to become data analyst in 2022 Timeline -------------------------------------------- 00:00 ...
Announcing Computer Vision with Embedded Machine Learning Course on Coursera,20K views,Edge Impulse,https://www.youtube.com/watch?v=L73PPfbel-0,https://www.youtube.com/c/EdgeImpulse,1 year ago,"With the popularity and success of our first Introduction to Embedded Machine Learning course, we decided to launch another!"
How To Install numpy scipy matplotlib pandas on Windows | Python Tutorials,60K views,Amulya's Academy,https://www.youtube.com/watch?v=iOdfeyw_2aY,https://www.youtube.com/c/AmulsAcademy,3 years ago,In this Python Programming video tutorial you will learn about how to install numpy scipy matplotlib and pandas libraries in detail.
