Video_Title,Total_Views,Channel_Name,Video_Link,Channel_Link,Publish_Date,Description
Learn R for Data Science,151 views,Experfy,https://www.youtube.com/watch?v=CVXswSqQDi0,https://www.youtube.com/c/Experfy,4 years ago,"Learn R Programming by doing! There are lots of R courses and lectures out there. However, R has a very steep learning curve ..."
Computer Vision - Lecture 1.3 (Introduction: History of Computer Vision),6.3K views,Tübingen Machine Learning,https://www.youtube.com/watch?v=hCewSTTOt_4,https://www.youtube.com/c/T%C3%BCbingenML,1 year ago,"Lecture: Computer Vision (Prof. Andreas Geiger, University of Tübingen) Course Website with Slides, Lecture Notes, Problems ..."
EPISODE 144: The applications of natural language processing,133 views,Cynozure,https://www.youtube.com/watch?v=vIMlQjQMg6g,https://www.youtube.com/c/Cynozure,1 month ago,"In this episode, Jason Foster speaks to Jyotika Singh, Director of Data Science at Placemakr, about the uses of natural language ..."
How I use SQL as a Data Analyst,402K views,Luke Barousse,https://www.youtube.com/watch?v=GEBzsz8ZSXs,https://www.youtube.com/c/LukeBarousse,7 months ago,"Data Nerds!! Let's discuss how SQL is used in Data Science. For this, I cover the basics of how to use SQL; Additionally, we talk ..."
How computers learn to recognize objects instantly | Joseph Redmon,1M views,TED,https://www.youtube.com/watch?v=Cgxsv1riJhI,https://www.youtube.com/c/TED,5 years ago,"Today, computer vision systems do it with greater than 99 percent accuracy. How? Joseph Redmon works on the YOLO (You Only ..."
Natural Language Processing,14 views,Samuel Cummings,https://www.youtube.com/watch?v=Hc9xuLb-DXo,https://www.youtube.com/channel/UC8zGbCAFN_Wjlgl-b9GLu9g,2 months ago,Video for cse450 Final. Link to Google Slides: ...
What is Data Science? | Introduction to Data Science | Data Science for Beginners | Simplilearn,409K views,Simplilearn,https://www.youtube.com/watch?v=KxryzSO1Fjs,https://www.youtube.com/c/SimplilearnOfficial,4 years ago,"Boost your career with Simplilearn's 6-months Data Science Job Guarantee Program with a placement, guarantee! Land your ..."
Group Discussion: USA - Careers in Bioinformatics and Data Science,34 views,Pine Biotech,https://www.youtube.com/watch?v=os-bUAPZWy8,https://www.youtube.com/c/Pine-biotech,16 hours ago,How Bioinformatics has Revolutionized Research - Skillsets required for students to excel in the field of Bioinformatics and Data ...
What is Data Science || कैसे बने  Data Scientist Complete Roadmap इसी Video में |,6.5K views,Business Sections,https://www.youtube.com/watch?v=ohHc6yI7acU,https://www.youtube.com/c/BusinessSections,1 month ago,Hey Dosto ! In this video we discussed What is Data Science and how to become a data science engineer . start your Data ...
Data Science Vs Data Analytics | Which One Should You Choose | Great Learning,102K views,Great Learning,https://www.youtube.com/watch?v=yFmkK94rnc0,https://www.youtube.com/c/GreatLearningOfficial,2 years ago,This Great Learning video on “Data Science Vs Data Analytics” will use a Formula One analogy to compare these disciplines.
NLP Tutorial | What is Natural Language Processing? | NLP Full Course | Great Learning,11K views,Great Learning,https://www.youtube.com/watch?v=igKTO7lQxNo,https://www.youtube.com/c/GreatLearningOfficial,4 months ago,"Natural Language Processing is the branch of computer science and, more specifically, the branch of artificial intelligence or ..."
day in the life of a Data Scientist at a tech start-up,19K views,The Almost Astrophysicist,https://www.youtube.com/watch?v=0-VMU9Im45I,https://www.youtube.com/c/TheAlmostAstrophysicist,7 months ago,hellloooo here's a day in the life of a Data Scientist!! I'm LOVING my new job at my new company so here's a full day in the life at a ...
Transformers in Natural Language Processing | Data Science Summer School 2022,628 views,Hertie School Data Science Lab,https://www.youtube.com/watch?v=otH29Uoo-HE,https://www.youtube.com/c/HertieSchoolDataScienceLab,Streamed 1 month ago,"In recent years, the transformer architecture has proved to be revolutionary in the field of Deep Learning by outperforming the ..."
A Practical Introduction to Data Science using the Spaceship Titanic Dataset from Kaggle,46 views,Automata Learning Lab,https://www.youtube.com/watch?v=HReBjpi9dCY,https://www.youtube.com/channel/UCu8WF59Scx9f3H1N_FgZUwQ,18 hours ago,In this video we will do a practical and simplified introduction to data science using the spaceship titanic dataset from kaggle.
Data Analyst vs Business Analyst - What's the Difference? #shorts | upGrad,50K views,upGrad,https://www.youtube.com/shorts/jqrlYgT3lhE,https://www.youtube.com/c/UpGradGlobal,3 months ago,"Would you be better suited to become a business analyst or a data analyst?* In smaller organizations, these job titles are ..."
Freelancing tips in Data Science & Analytics | 2022,14K views,Satyajit Pattnaik,https://www.youtube.com/watch?v=z-vgp6S6CyY,https://www.youtube.com/c/SatyajitPattnaik,2 years ago,Freelancing tips in Data Science & Analytics | 2022 Have some questions regarding how to get freelancing projects in the field of ...
SQL Problem Asked in InData Labs | SQL For Data Science,744 views,CloudyML,https://www.youtube.com/watch?v=r-SvsSuTkYM,https://www.youtube.com/c/cloudyML,2 months ago,In this video we will look into SQL problem asked in InData Labs for the role of data analyst. Check our Data Science & Analytics ...
Few Important Pointers For Preparing Fresher Data Science Resumes,27K views,Krish Naik,https://www.youtube.com/watch?v=uuicl8lJuyk,https://www.youtube.com/user/krishnaik06,11 months ago,Register For Relevel for applying for some amazing jobs:https://relvl.co/bsg7 ⭐ Kite is a free AI-powered coding assistant that will ...
What is Computer Vision Syndrome & 20-20-20 Rule To Protect Eyes by Polaris Hospital Kharghar,13 views,Polaris Hospital,https://www.youtube.com/shorts/IcvkbgK9soQ,https://www.youtube.com/channel/UCe1xgD9j5uI4Uj_in1-3eLg,20 hours ago,Computer vision syndrome (CVS) is a condition that results from staring at a computer screen for long periods of time. CVS can ...
Data Science Course Tutorial with R for Beginners - Go from Beginner To Expert,3.8K views,Lunes eLearning,https://www.youtube.com/watch?v=Cq_QzzmItQw,https://www.youtube.com/channel/UCZaDJfCUIbkXolm8uYskZuw,1 year ago,"In this video, we go through an introduction to Data Science with R programming. This video takes you from beginner to expert in ..."
NLP - What is Natural Language Processing?,993 views,Statistics of DOOM,https://www.youtube.com/watch?v=YKBdl2FJIOY,https://www.youtube.com/c/StatisticsofDOOM,3 years ago,Lecturer: Dr. Erin M. Buchanan This video is the first in my series of natural language processing focusing on python's natural ...
A Complete Guide To Become A Data Scientist🚀,619K views,Rahul M,https://www.youtube.com/watch?v=9ndQovLzXVQ,https://www.youtube.com/c/RahulMyoutubeChannel,6 months ago,Registration Link - https://relvl.co/hla4 Job Details Page Link- Business Development: upGrad(BD) https://relvl.co/8rr Urban ...
Scientific Python Tutorial Workshop | Part 1 | Basics & NumPy,1.5K views,MUSEN Center - TU Braunschweig,https://www.youtube.com/watch?v=CIRGYcCasyI,https://www.youtube.com/channel/UCnwbvnm966l-49OqD_xUCeg,2 months ago,00:00:00 Introduction & Overview 00:09:03 General Tips & Why Python 00:21:04 Interacting with Python 00:47:45 Basics of ...
Basic Computer Vision with ML (ML Zero to Hero - Part 2),295K views,TensorFlow,https://www.youtube.com/watch?v=bemDFpNooA8,https://www.youtube.com/c/TensorFlow,3 years ago,"In part two of Machine Learning Zero to Hero, AI Advocate Laurence Moroney (lmoroney@) walks through basic computer vision ..."
"SQL Window Functions on Data Science Interviews in 2021 | Asked By Airbnb, Netflix, Twitter, Uber",73K views,StrataScratch,https://www.youtube.com/watch?v=XBE09l-UYTE,https://www.youtube.com/channel/UCW8Ews7tdKKkBT6GdtQaXvQ,1 year ago,"Let's cover 4 SQL window function interview questions asked on Airbnb, Netflix, Twitter, and Uber data science interviews. I cover ..."
Introduction to R for Data Science,32 views,arnab sadhu,https://www.youtube.com/watch?v=Ero4tq2Tu1g,https://www.youtube.com/c/arnabsadhucs,1 year ago,In this video I discuss about R as a language of Data Science. From the set up and to the use of different packages have been ...
Do We Require Master OR PHD to Become Data Scientist?,12K views,Krish Naik,https://www.youtube.com/watch?v=w0PC3BTafdo,https://www.youtube.com/user/krishnaik06,3 years ago,"Hello All, In this video I am going to clear your myth, do we require Masters or PHD to Become Data Scientist. Support me in ..."
Programming with R as a Data Analyst | Google Data Analytics Certificate,9.5K views,Google Career Certificates,https://www.youtube.com/watch?v=fFkg8iOQ1ck,https://www.youtube.com/c/GoogleCareerCertificates,1 year ago,Learning R will help you take your data analysis to the next level. It'll also look great on your resume. R is widely recognized as a ...
Complete Data Analyst Roadmap | How to become a Data Analyst | Data Analytics Career Job and Course,358K views,Anuj Bhaiya,https://www.youtube.com/watch?v=A4Z-A-oUPuc,https://www.youtube.com/c/AnujBhaiya,6 months ago,... #roadmap Tags: data analyst data analyst roadmap data analytics data analyst course anuj bhaiya data science full course data ...
[Live] Learning R For Data Science | Basic Operations For DataFrame | Lecturer-3,389 views,Data Science Bioinformatics,https://www.youtube.com/watch?v=EKYwrraDUgc,https://www.youtube.com/channel/UC8HVUWFcUhEGmt_flxUa_9g,Streamed 1 year ago,Learning R For Data Science | Basic Operations For DataFrame | Lecturer-3 Welcome to DataScience with Naeem. Data Science ...
"7. Natural Language Processing (NLP), Part 1",20K views,MIT OpenCourseWare,https://www.youtube.com/watch?v=IiD3YZkkCmE,https://www.youtube.com/c/mitocw,1 year ago,"This lecture and the next covers the role of Natural Language Processing in machine learning in healthcare. In this lecture, Prof."
Is Becoming a Data Scientist Hard?,41K views,codebasics,https://www.youtube.com/watch?v=pOXmn7jP9gQ,https://www.youtube.com/c/codebasics,2 years ago,"HBR named data scientist the sexiest job of the 21st century. If companies are paying so high for data scientist jobs, it must be not ..."
Top 10 Udemy Courses for Data Analysts,98K views,Alex The Analyst,https://www.youtube.com/watch?v=ySq0cgkZiX4,https://www.youtube.com/c/AlexTheAnalyst,1 year ago,SQL for Data Analysts (SSMS) - https://bit.ly/3fkqEij 2. PostgreSQL Zero to Hero - https://bit.ly/2RHMUJc 3. MySQL for Data ...
R for Data Science - Full Course - Learn R for Data Science in 6 Hours,166K views,CodingPly,https://www.youtube.com/watch?v=NVyOEwOJgNQ,https://www.youtube.com/c/CodingPly,2 years ago,This video is the introductory course in R programming for Data Science. 0:00 About this course 0:10 What is R ? Why R? 2:09 ...
Natural Language Processing | NLP with Deep Learning and Machine Learning | NLP Using Python,47K views,Intellipaat,https://www.youtube.com/watch?v=68lIfswwG2A,https://www.youtube.com/c/Intellipaat,Streamed 1 year ago,#NaturalLanguageProcessing #NLPdeeplearning #NLPMachineLearning #NLPPython #NLPCourse #NLPTraining #NLPTutorial ...
Machine Learning with Python | Machine Learning Tutorial for Beginners | Machine Learning Tutorial,1.1M views,Great Learning,https://www.youtube.com/watch?v=RnFGwxJwx-0,https://www.youtube.com/c/GreatLearningOfficial,2 years ago,Machine learning is defined as the “use and development of computer systems that can learn and adapt without following explicit ...
Data Science with SQL Server Machine Learning Services,4.3K views,Dinesh Priyankara,https://www.youtube.com/watch?v=47uceTJkLPk,https://www.youtube.com/c/DineshPriyankara,2 years ago,"This video discusses performing data science experiments in SQL Server using Python. Setting up the environment, training, ..."
Average Data Scientist salary for entry level Malaysia,2.3K views,MyCareer Official,https://www.youtube.com/watch?v=Wj2LxrzbOrs,https://www.youtube.com/channel/UC306DEeh3WjqMXoWFyKPILQ,1 year ago,Data science sharing with Bro Hasif Host : Mr Nope & Darwish Danial.
SQL for Data Analysis | Learn End to End SQL Live | MySQL Full Course | Part III,4.1K views,Satyajit Pattnaik,https://www.youtube.com/watch?v=YPAd_PSeU7s,https://www.youtube.com/c/SatyajitPattnaik,Streamed 3 months ago,"Welcome to the End to End SQL Live Classes by Satyajit Pattnaik. This is the first class of the series, and below is the overall ..."
Machine Learning Algorithms | Machine Learning Tutorial | Data Science Training | Edureka,324K views,edureka!,https://www.youtube.com/watch?v=Up6KLx3m2ww,https://www.youtube.com/c/edurekaIN,5 years ago,1) What is an Algorithm? 2) What is Machine Learning? 3) How is a problem solved using Machine Learning? 4) Types of ...
Steps in Natural Language Processing,8.6K views,Kanchan Dabre,https://www.youtube.com/watch?v=HeWmkJk3yQI,https://www.youtube.com/channel/UCdqcXpJOeBe6n8xhZaOpKrA,2 years ago,"Stages in Natural Language Processing are explained in the simplest way. Also, find my NLP video links Video on Introduction to ..."
🤩 Build Awesome Data Analytics Portfolio from Scratch in 2022 // 4 Portfolio project ideas,171K views,Thu Vu data analytics,https://www.youtube.com/watch?v=XYKuslcJp7A,https://www.youtube.com/c/Thuvu5,9 months ago,"In today's video, I'm sharing with you how to build a data portfolio if you're looking for an entry-level data analyst/ data science ..."
R For Data Science Full Course | Data Science With R Full Course |Data Science with R -Part-10,82 views,KSR Datavizon ,https://www.youtube.com/watch?v=akN-HvDRkaE,https://www.youtube.com/c/KSRDatavizon,1 year ago,"In this video on R for Data Science Full Course, we'll start by learning data science from introduction video. You will then learn the ..."
Data Science - python - Numpy vs Pandas,1.4K views,Data Science School,https://www.youtube.com/watch?v=U13xnGA6IT0,https://www.youtube.com/channel/UCuJmBoLKvgsMbNdI1yZrU3Q,3 years ago,
Seaborn Is The Easier Matplotlib,71K views,NeuralNine,https://www.youtube.com/watch?v=ooqXQ37XHMM,https://www.youtube.com/c/NeuralNine,5 months ago,"This video is about Seaborn, an external Python data visualization library, which is based on Matplotlib."
Introduction to Deep Learning: Machine Learning vs. Deep Learning,400K views,MATLAB,https://www.youtube.com/watch?v=-SgkLEuhfbg,https://www.youtube.com/c/matlab,5 years ago,The video outlines the specific workflow for solving a machine learning problem. The video also outlines the differing ...
Fun With SQL and  Power BI,27 views,Caribou Data Science,https://www.youtube.com/watch?v=mpqf5GMjoH4,https://www.youtube.com/c/CaribouDataScience,Streamed 1 day ago,"PowerBI, #BI, #BusinessIntelligence, #dataanalytics, #bigfoot."
He became top rated freelancer in first 4 months on upwork | Data analyst freelancer,325K views,codebasics,https://www.youtube.com/watch?v=sQnG6XiFfLE,https://www.youtube.com/c/codebasics,1 year ago,"Data analyst freelancer: Qasim Bhatti started freelancing on upwork in August, 2020 and within 4 months he reached to a level ..."
Python Vs R (funny!),102K views,Luke Barousse,https://www.youtube.com/watch?v=DGrszAeMZJI,https://www.youtube.com/c/LukeBarousse,1 year ago,Check out my channel for ACTUAL informative data science videos @Luke Barousse Certificates & Courses ...
Five Natural Language Processing Research Trends to Watch in 2021,6.2K views,The Global NLP Lab,https://www.youtube.com/watch?v=wnGgvHiIoZo,https://www.youtube.com/c/TheGlobalNLPLab,1 year ago,Top 5 Natural Language Processing research trends I think will be growing in 2021.
What Is Data Science? (Explained in 5 Minutes),95K views,365 Data Science,https://www.youtube.com/watch?v=uswU1s3M2VE,https://www.youtube.com/c/365DataScience,1 year ago,You want to learn what Data Science is? And you like brief explanations? Then this is the perfect video for you! Video ...
How to install R and RStudio on Windows - R for Data Science,119 views,Data Ninjas,https://www.youtube.com/watch?v=CzdQLHqvYmU,https://www.youtube.com/channel/UC84-UdinLn6TwQ696h1A1SA,1 year ago,This video explains the process to install the essential pieces of software to work with the R language in a Windows operating ...
Machine Learning Engineer vs Data Scientist vs Data Engineer,9.6K views,Coding Tech,https://www.youtube.com/watch?v=1xKzPBwBdn8,https://www.youtube.com/c/CodingTech,8 months ago,"There's one specific role that builds a bridge between data science and its practical counterpart, machine learning. Meet the ..."
TF-IDF - Natural Language Processing | Class 10 Artificial Intelligence,4.4K views,Magnet Brains,https://www.youtube.com/watch?v=rv5ux2LkTns,https://www.youtube.com/c/MagnetBrainsEducation,4 months ago,"✓ In this video, ✔️ Class: 10th ✔️ Subject: Artificial Intelligence ✔️ Chapter: Natural Language Processing ✔️ Topic Name: ..."
Microsoft SQL Interview Question for Data Scientists and Data Analysts (StrataScratch 2024),1.5K views,Frederik Müller,https://www.youtube.com/watch?v=pzI71OEE73g,https://www.youtube.com/channel/UCuDWqzSSHgHkD0zBwrIXSNQ,1 year ago,Solution and walkthrough of a real SQL interview question for Data Scientist and Data Analyst technical coding interviews.
"Natural Language Processing Explained for Beginners-Basics, Features and NLP Models",339 views,AI Sciences,https://www.youtube.com/watch?v=BOosct7Mtp4,https://www.youtube.com/c/AISciencesLearn,1 year ago,"In this video, we are going to discuss Natural Language Processing, its applications, features, and models. We will discuss the ..."
Learn SQL for Data Analysis in one hour (with sample dataset + 50 queries),134K views,Chandoo,https://www.youtube.com/watch?v=l8DCPaHc5TQ,https://www.youtube.com/c/ExcelTutorials,1 month ago,"SQL is one of the most important skills to have for data people. In this comprehensive video, learn how to use SQL to perform ..."
FASTEST Way to Become a Data Analyst and ACTUALLY Get a Job,721K views,Stefanovic,https://www.youtube.com/watch?v=AYWLZ1lES6g,https://www.youtube.com/c/Stefanovic92,2 months ago,#dataanalytics #datascience #data ▻FOLLOW MY JOURNEY: Instagram: https://instagram.com/stefanovic92 ▻I TWEET ABOUT ...
Understand R | Analytics using R in Hadoop | R for Data Science | Edureka,5.5K views,edureka!,https://www.youtube.com/watch?v=DNWmeJ7Jsjk,https://www.youtube.com/c/edurekaIN,7 years ago,"Data science is the study of the generalizable extraction of knowledge from data, yet the key word is science. The tutorial wil give ..."
"Become a Data Analyst | বিকাম এ ডেটা এনালিস্ট | Python, SQL, Power Bi, Tableau, Excel & Data Studio",1.2K views,STUDY MART,https://www.youtube.com/watch?v=HubX3iltJgc,https://www.youtube.com/c/studymart,5 months ago,"Tags: data analysis,power bi,tableau,google data studio,data analyst,data analytics,quantitative data analysis,data analytics for ..."
Impact of Natural Language Processing On AI,30 views,contenteratechspace - TechBlogger,https://www.youtube.com/watch?v=gCuUYG7mw3A,https://www.youtube.com/channel/UCfwBCadynKZqJ0sRjY5puTQ,2 years ago,Natural language processing in artificial intelligence (NLP) has become as integral to workplace communication as part of ...
Complete Roadmap To SQL And 100+Interview Questions With Answers For Data Scientist And Data Analyst,36K views,Krish Naik,https://www.youtube.com/watch?v=tT1oLM-EaYk,https://www.youtube.com/user/krishnaik06,1 year ago,MySQL Interview Questions: https://github.com/krishnaik06/Python-Practise-Problems/blob/main/sql%20interview.docx Complete ...
LED control using Hand Gesture(Arduino and Computer vision algorithm).,4 views,Haastrup Adebayo Ibukun,https://www.youtube.com/watch?v=p_Hr7AOrm8o,https://www.youtube.com/channel/UC7-vjPHcnJMER5J4PnZ8nKw,22 hours ago,
5 crucial skills needed to be a Data Analyst | #dataanalyst #datascience #data #computerscience,306 views,Shivam Bhirud,https://www.youtube.com/shorts/lvx1Vc_g6-A,https://www.youtube.com/c/ShivamBhirud,2 months ago,5 crucial skills for becoming a Data Analyst! Explained with brief reasons in the video. Do save it for later. Subscribe @Shivam ...
A Day in The Life of a Google Data Scientist (Analytics),788K views,Sundas Khalid,https://www.youtube.com/watch?v=CSdpk6NzvhY,https://www.youtube.com/c/SundasKhalid,11 months ago,"Hi friends, sharing a typical day in my life at Google. I have been at Google for the past two years and truly enjoy the Google office ..."
Solving a LinkedIn Data Science SQL Interview Question,28K views,Data Science Jay,https://www.youtube.com/watch?v=d2920ysu2hQ,https://www.youtube.com/c/DataScienceJay,2 years ago,"Hi everyone, today I go over how to tackle a medium difficulty interview question asked on a data science interview at LinkedIn!"
"Machine Learning, Deep Learning, emerging, emerging technologies in global business environment, mba",3.6K views,DWIVEDI GUIDANCE,https://www.youtube.com/watch?v=uDaypv0KP_M,https://www.youtube.com/c/DWIVEDIGUIDANCE,4 months ago,"Industry 4.0 : Meaning, Nature : https://youtu.be/o_nP6-Cy8X0 Digital Transformation : https://youtu.be/vdrjCtvlhYQ Artificial ..."
"Data Science Salaries in Amsterdam: Talking about Money 🤑, Benefits & Dutch Working Culture",10K views,Thu Vu data analytics,https://www.youtube.com/watch?v=MsdyvI3ZI5k,https://www.youtube.com/c/Thuvu5,7 months ago,"Hello everyone! In today's video, I'll be talking about the data science job landscape in Amsterdam, the Netherlands: salaries of ..."
What Is the Difference Between a Data Analyst and a Data Scientist?,41K views,Lights OnData,https://www.youtube.com/watch?v=ORYBRStrnTw,https://www.youtube.com/c/LightsOnData,1 year ago,"WHAT IS THE DIFFERENCE BETWEEN A DATA ANALYST AND A DATA SCIENTIST? // Let's look at the scope, skills, education, ..."
SQL for Data Science | All Quiz & Assignment Answers | Coursera | University of California,11K views,Shafayet Bhuiyan,https://www.youtube.com/watch?v=KqWPAQ1XCUg,https://www.youtube.com/c/ShafayetBhuiyan,2 years ago,SQL for Data Science | All Quiz & Assignment Answers | Coursera | University of California SQL for Data Science ll Part of Learn ...
Beginner to Pro FREE Excel Data Analysis Course,888K views,Chandoo,https://www.youtube.com/watch?v=v2oNWja7M2E,https://www.youtube.com/c/ExcelTutorials,1 year ago,"You asked for it. Here is my free course to help you kick start your data analytics journey. In this comprehensive video, learn: 1) ..."
"Data Analysis with Python - Full Course for Beginners (Numpy, Pandas, Matplotlib, Seaborn)",2.1M views,freeCodeCamp.org,https://www.youtube.com/watch?v=r-uOLxNrNk8,https://www.youtube.com/c/Freecodecamp,2 years ago,"Learn Data Analysis with Python in this comprehensive tutorial for beginners, with exercises included! NOTE: Check description ..."
What is Natural Language Processing  {in தமிழ்}?,7.2K views,Data Engineering,https://www.youtube.com/watch?v=LAtzapS2GBU,https://www.youtube.com/c/atozknowledgevideos,4 years ago,The application of computational techniques to the analysis and synthesis of natural language and speech. Python Core ...
Data Scientist क्या होता है | Artificial Intelligence | Machine Learning | Data Analyst | HINDI,59 views,Scientific Abhay,https://www.youtube.com/watch?v=540c6bmMbQ0,https://www.youtube.com/channel/UCtTkHZqVqEI1HawpY-FXqcQ,2 years ago,"In this video I have talked about ""Data Scientist"" Role of Data Scientist, What is Data Scientist? Machine Learning VS Data ..."
Data Analyst vs Data Engineer vs Data Scientist,143K views,codebasics,https://www.youtube.com/watch?v=q9oAZwhuUy4,https://www.youtube.com/c/codebasics,2 years ago,Want to know the difference between Data Analyst vs Data Engineer vs Data Scientist? Keep watching this video to know. Data ...
Data Analytics #Datascience #SQL #Power-Bi #Python #Tableau #R #Excel #Advance Excel.,147 views,The Analytical Mind,https://www.youtube.com/watch?v=gahN2anSLDw,https://www.youtube.com/channel/UCdACNAdfNge7_dSTDVzb14w,1 year ago,This is the just introduction of what you can get from this channel....!! complete package of Data Analytics.
The Most Useful Python Libraries For Data Science (My Top 5!),236 views,Samanvay Karambhe,https://www.youtube.com/watch?v=KVAyGxGEh3w,https://www.youtube.com/c/SamanvayKarambhe,3 months ago,The great thing about coding in python is the large number of python libraries that allow you to do amazing things! I will talk about ...
"Learn data analyst skills in 3 months, step by step | Complete data analyst roadmap in 2022",1.2M views,codebasics,https://www.youtube.com/watch?v=_eAl7vuVu3U,https://www.youtube.com/c/codebasics,1 year ago,Do you want to learn data analyst skills and not sure where to start? In this video I will provide a 3 months step by step roadmap to ...
"4 reasons why you may HATE BEING a Data Scientist, but LOVE DOING Data Science",32K views,Anastasia K,https://www.youtube.com/watch?v=qPobFkotqx8,https://www.youtube.com/c/AnastasiaKVL,1 year ago,"To make sure you will like DOING Data Science and Analytics, I broke out a few areas where it's important to know if you like ..."
Machine Learning Tutorial | Machine Learning Basics | Machine Learning Algorithms | Simplilearn,194K views,Simplilearn,https://www.youtube.com/watch?v=G7fPB4OHkys,https://www.youtube.com/c/SimplilearnOfficial,4 years ago,This Machine Learning tutorial will cover the following topics: 1. Life without Machine Learning ( 01:06 ) 2. Life with Machine ...
